root@ubuntu-s-1vcpu-1gb-tor1-01:~# tcpdump -r 0001.pcap
reading from file 0001.pcap, link-type EN10MB (Ethernet)
23:54:09.947752 IP ubuntu-s-1vcpu-1gb-tor1-01.ssh > cpef81d0faa8f73-cmf81d0faa8f70.cpe.net.cable.rogers.com.59557: Flags [P.], seq 1343052709:1343052753, ack 3027046461, win 501, options [nop,nop,TS val 3071179552 ecr 383815288], length 44
23:54:09.947876 IP ubuntu-s-1vcpu-1gb-tor1-01.ssh > cpef81d0faa8f73-cmf81d0faa8f70.cpe.net.cable.rogers.com.59557: Flags [P.], seq 44:152, ack 1, win 501, options [nop,nop,TS val 3071179552 ecr 383815288], length 108
23:54:09.947958 IP ubuntu-s-1vcpu-1gb-tor1-01.ssh > ip-198-12-249-249.ip.secureserver.net.34386: Flags [.], ack 905088090, win 501, length 0
23:54:09.948040 IP ubuntu-s-1vcpu-1gb-tor1-01.ssh > cpef81d0faa8f73-cmf81d0faa8f70.cpe.net.cable.rogers.com.59557: Flags [P.], seq 152:188, ack 1, win 501, options [nop,nop,TS val 3071179552 ecr 383815288], length 36
23:54:09.971042 IP cpef81d0faa8f73-cmf81d0faa8f70.cpe.net.cable.rogers.com.59557 > ubuntu-s-1vcpu-1gb-tor1-01.ssh: Flags [.], ack 188, win 32764, options [nop,nop,TS val 383815314 ecr 3071179552], length 0
23:54:10.350237 IP 92.63.197.86.51319 > ubuntu-s-1vcpu-1gb-tor1-01.1945: Flags [S], seq 1765167008, win 1024, length 0
23:54:10.350297 IP ubuntu-s-1vcpu-1gb-tor1-01.1945 > 92.63.197.86.51319: Flags [R.], seq 0, ack 1765167009, win 0, length 0
23:54:10.459621 IP 92.63.197.86.51319 > ubuntu-s-1vcpu-1gb-tor1-01.1945: Flags [R], seq 1765167009, win 1200, length 0
23:54:11.678382 IP 217.112.104.202.broad.sz.gd.dynamic.163data.com.cn.35862 > ubuntu-s-1vcpu-1gb-tor1-01.ssh: Flags [S], seq 253077944, win 14600, options [mss 1460,sackOK,TS val 350517811 ecr 0,nop,wscale 7], length 0
23:54:11.678446 IP ubuntu-s-1vcpu-1gb-tor1-01.ssh > 217.112.104.202.broad.sz.gd.dynamic.163data.com.cn.35862: Flags [S.], seq 2494040529, ack 253077945, win 65160, options [mss 1460,sackOK,TS val 3026589296 ecr 350517811,nop,wscale 7], length 0
23:54:11.916950 IP 217.112.104.202.broad.sz.gd.dynamic.163data.com.cn.35862 > ubuntu-s-1vcpu-1gb-tor1-01.ssh: Flags [.], ack 1, win 115, options [nop,nop,TS val 350518050 ecr 3026589296], length 0
23:54:11.937799 IP ubuntu-s-1vcpu-1gb-tor1-01.ssh > 217.112.104.202.broad.sz.gd.dynamic.163data.com.cn.35862: Flags [P.], seq 1:42, ack 1, win 510, options [nop,nop,TS val 3026589555 ecr 350518050], length 41
23:54:12.176444 IP 217.112.104.202.broad.sz.gd.dynamic.163data.com.cn.35862 > ubuntu-s-1vcpu-1gb-tor1-01.ssh: Flags [.], ack 42, win 115, options [nop,nop,TS val 350518309 ecr 3026589555], length 0
23:54:12.176444 IP 217.112.104.202.broad.sz.gd.dynamic.163data.com.cn.35862 > ubuntu-s-1vcpu-1gb-tor1-01.ssh: Flags [P.], seq 1:22, ack 42, win 115, options [nop,nop,TS val 350518309 ecr 3026589555], length 21
23:54:12.176491 IP ubuntu-s-1vcpu-1gb-tor1-01.ssh > 217.112.104.202.broad.sz.gd.dynamic.163data.com.cn.35862: Flags [.], ack 22, win 510, options [nop,nop,TS val 3026589794 ecr 350518309], length 0
23:54:12.178945 IP ubuntu-s-1vcpu-1gb-tor1-01.ssh > 217.112.104.202.broad.sz.gd.dynamic.163data.com.cn.35862: Flags [P.], seq 42:1098, ack 22, win 510, options [nop,nop,TS val 3026589796 ecr 350518309], length 1056
23:54:12.418226 IP 217.112.104.202.broad.sz.gd.dynamic.163data.com.cn.35862 > ubuntu-s-1vcpu-1gb-tor1-01.ssh: Flags [P.], seq 22:462, ack 1098, win 131, options [nop,nop,TS val 350518551 ecr 3026589796], length 440
23:54:12.418291 IP ubuntu-s-1vcpu-1gb-tor1-01.ssh > 217.112.104.202.broad.sz.gd.dynamic.163data.com.cn.35862: Flags [.], ack 462, win 507, options [nop,nop,TS val 3026590036 ecr 350518551], length 0
23:54:12.656999 IP 217.112.104.202.broad.sz.gd.dynamic.163data.com.cn.35862 > ubuntu-s-1vcpu-1gb-tor1-01.ssh: Flags [P.], seq 462:510, ack 1098, win 131, options [nop,nop,TS val 350518790 ecr 3026590036], length 48
23:54:12.657051 IP ubuntu-s-1vcpu-1gb-tor1-01.ssh > 217.112.104.202.broad.sz.gd.dynamic.163data.com.cn.35862: Flags [.], ack 510, win 507, options [nop,nop,TS val 3026590274 ecr 350518790], length 0
23:54:12.675727 IP ubuntu-s-1vcpu-1gb-tor1-01.ssh > 217.112.104.202.broad.sz.gd.dynamic.163data.com.cn.35862: Flags [P.], seq 1098:1378, ack 510, win 507, options [nop,nop,TS val 3026590293 ecr 350518790], length 280
23:54:12.917956 IP 217.112.104.202.broad.sz.gd.dynamic.163data.com.cn.35862 > ubuntu-s-1vcpu-1gb-tor1-01.ssh: Flags [P.], seq 510:526, ack 1378, win 148, options [nop,nop,TS val 350519051 ecr 3026590293], length 16
23:54:12.918017 IP ubuntu-s-1vcpu-1gb-tor1-01.ssh > 217.112.104.202.broad.sz.gd.dynamic.163data.com.cn.35862: Flags [.], ack 526, win 507, options [nop,nop,TS val 3026590535 ecr 350519051], length 0
23:54:13.156647 IP 217.112.104.202.broad.sz.gd.dynamic.163data.com.cn.35862 > ubuntu-s-1vcpu-1gb-tor1-01.ssh: Flags [P.], seq 526:578, ack 1378, win 148, options [nop,nop,TS val 350519289 ecr 3026590535], length 52
23:54:13.156690 IP ubuntu-s-1vcpu-1gb-tor1-01.ssh > 217.112.104.202.broad.sz.gd.dynamic.163data.com.cn.35862: Flags [.], ack 578, win 507, options [nop,nop,TS val 3026590774 ecr 350519289], length 0
23:54:13.156873 IP ubuntu-s-1vcpu-1gb-tor1-01.ssh > 217.112.104.202.broad.sz.gd.dynamic.163data.com.cn.35862: Flags [P.], seq 1378:1430, ack 578, win 507, options [nop,nop,TS val 3026590774 ecr 350519289], length 52
23:54:13.184600 IP ubuntu-s-1vcpu-1gb-tor1-01.ssh > ip-198-12-249-249.ip.secureserver.net.34386: Flags [P.], seq 0:68, ack 1, win 501, length 68
23:54:13.205527 IP ip-198-12-249-249.ip.secureserver.net.34386 > ubuntu-s-1vcpu-1gb-tor1-01.ssh: Flags [P.], seq 1:53, ack 68, win 262, length 52
23:54:13.205528 IP ip-198-12-249-249.ip.secureserver.net.34386 > ubuntu-s-1vcpu-1gb-tor1-01.ssh: Flags [F.], seq 53, ack 68, win 262, length 0
23:54:13.205578 IP ubuntu-s-1vcpu-1gb-tor1-01.ssh > ip-198-12-249-249.ip.secureserver.net.34386: Flags [.], ack 53, win 501, length 0
23:54:13.209286 IP ubuntu-s-1vcpu-1gb-tor1-01.ssh > ip-198-12-249-249.ip.secureserver.net.34386: Flags [F.], seq 68, ack 54, win 501, length 0
23:54:13.224509 IP ip-198-12-249-249.ip.secureserver.net.34386 > ubuntu-s-1vcpu-1gb-tor1-01.ssh: Flags [.], ack 69, win 262, length 0
23:54:13.395527 IP 217.112.104.202.broad.sz.gd.dynamic.163data.com.cn.35862 > ubuntu-s-1vcpu-1gb-tor1-01.ssh: Flags [P.], seq 578:662, ack 1430, win 148, options [nop,nop,TS val 350519528 ecr 3026590774], length 84
23:54:13.436020 IP ubuntu-s-1vcpu-1gb-tor1-01.ssh > 217.112.104.202.broad.sz.gd.dynamic.163data.com.cn.35862: Flags [.], ack 662, win 507, options [nop,nop,TS val 3026591053 ecr 350519528], length 0
23:54:15.034436 IP ubuntu-s-1vcpu-1gb-tor1-01.ssh > 217.112.104.202.broad.sz.gd.dynamic.163data.com.cn.35862: Flags [P.], seq 1430:1498, ack 662, win 507, options [nop,nop,TS val 3026592652 ecr 350519528], length 68
23:54:15.273392 IP 217.112.104.202.broad.sz.gd.dynamic.163data.com.cn.35862 > ubuntu-s-1vcpu-1gb-tor1-01.ssh: Flags [P.], seq 662:714, ack 1498, win 148, options [nop,nop,TS val 350521406 ecr 3026592652], length 52
23:54:15.273393 IP 217.112.104.202.broad.sz.gd.dynamic.163data.com.cn.35862 > ubuntu-s-1vcpu-1gb-tor1-01.ssh: Flags [F.], seq 714, ack 1498, win 148, options [nop,nop,TS val 350521406 ecr 3026592652], length 0
23:54:15.273440 IP ubuntu-s-1vcpu-1gb-tor1-01.ssh > 217.112.104.202.broad.sz.gd.dynamic.163data.com.cn.35862: Flags [.], ack 714, win 507, options [nop,nop,TS val 3026592891 ecr 350521406], length 0
23:54:15.276518 IP ubuntu-s-1vcpu-1gb-tor1-01.ssh > 217.112.104.202.broad.sz.gd.dynamic.163data.com.cn.35862: Flags [F.], seq 1498, ack 715, win 507, options [nop,nop,TS val 3026592894 ecr 350521406], length 0
23:54:15.515080 IP 217.112.104.202.broad.sz.gd.dynamic.163data.com.cn.35862 > ubuntu-s-1vcpu-1gb-tor1-01.ssh: Flags [.], ack 1499, win 148, options [nop,nop,TS val 350521648 ecr 3026592894], length 0
23:54:15.614548 IP 45.155.205.162.57672 > ubuntu-s-1vcpu-1gb-tor1-01.4974: Flags [S], seq 2873636562, win 1024, length 0
23:54:15.614594 IP ubuntu-s-1vcpu-1gb-tor1-01.4974 > 45.155.205.162.57672: Flags [R.], seq 0, ack 2873636563, win 0, length 0
23:54:15.743743 IP 45.155.205.162.57672 > ubuntu-s-1vcpu-1gb-tor1-01.4974: Flags [R], seq 2873636563, win 1200, length 0
23:54:16.321247 IP 123.127.237.41.47316 > ubuntu-s-1vcpu-1gb-tor1-01.ssh: Flags [S], seq 3225697532, win 29200, options [mss 1380,sackOK,TS val 2850959816 ecr 0,nop,wscale 7], length 0
23:54:16.321302 IP ubuntu-s-1vcpu-1gb-tor1-01.ssh > 123.127.237.41.47316: Flags [S.], seq 477315038, ack 3225697533, win 65160, options [mss 1460,sackOK,TS val 1432027217 ecr 2850959816,nop,wscale 7], length 0
23:54:16.569437 IP 123.127.237.41.47316 > ubuntu-s-1vcpu-1gb-tor1-01.ssh: Flags [.], ack 1, win 229, options [nop,nop,TS val 2850959879 ecr 1432027217], length 0
23:54:16.593161 IP ubuntu-s-1vcpu-1gb-tor1-01.ssh > 123.127.237.41.47316: Flags [P.], seq 1:42, ack 1, win 510, options [nop,nop,TS val 1432027489 ecr 2850959879], length 41
23:54:16.851958 IP 123.127.237.41.47316 > ubuntu-s-1vcpu-1gb-tor1-01.ssh: Flags [.], ack 42, win 229, options [nop,nop,TS val 2850959949 ecr 1432027489], length 0
23:54:16.851959 IP 123.127.237.41.47316 > ubuntu-s-1vcpu-1gb-tor1-01.ssh: Flags [P.], seq 1:22, ack 42, win 229, options [nop,nop,TS val 2850959949 ecr 1432027489], length 21
23:54:16.852020 IP ubuntu-s-1vcpu-1gb-tor1-01.ssh > 123.127.237.41.47316: Flags [.], ack 22, win 510, options [nop,nop,TS val 1432027747 ecr 2850959949], length 0
23:54:16.854509 IP ubuntu-s-1vcpu-1gb-tor1-01.ssh > 123.127.237.41.47316: Flags [P.], seq 42:1098, ack 22, win 510, options [nop,nop,TS val 1432027750 ecr 2850959949], length 1056
23:54:17.142997 IP 123.127.237.41.47316 > ubuntu-s-1vcpu-1gb-tor1-01.ssh: Flags [P.], seq 22:462, ack 1098, win 245, options [nop,nop,TS val 2850960022 ecr 1432027750], length 440
23:54:17.143085 IP ubuntu-s-1vcpu-1gb-tor1-01.ssh > 123.127.237.41.47316: Flags [.], ack 462, win 507, options [nop,nop,TS val 1432028038 ecr 2850960022], length 0
23:54:17.419042 IP 123.127.237.41.47316 > ubuntu-s-1vcpu-1gb-tor1-01.ssh: Flags [P.], seq 462:510, ack 1098, win 245, options [nop,nop,TS val 2850960091 ecr 1432028038], length 48
23:54:17.419083 IP ubuntu-s-1vcpu-1gb-tor1-01.ssh > 123.127.237.41.47316: Flags [.], ack 510, win 507, options [nop,nop,TS val 1432028314 ecr 2850960091], length 0
23:54:17.430707 IP ubuntu-s-1vcpu-1gb-tor1-01.ssh > 123.127.237.41.47316: Flags [P.], seq 1098:1378, ack 510, win 507, options [nop,nop,TS val 1432028326 ecr 2850960091], length 280
23:54:17.674733 IP 123.127.237.41.47316 > ubuntu-s-1vcpu-1gb-tor1-01.ssh: Flags [P.], seq 510:526, ack 1378, win 262, options [nop,nop,TS val 2850960155 ecr 1432028326], length 16
23:54:17.674854 IP ubuntu-s-1vcpu-1gb-tor1-01.ssh > 123.127.237.41.47316: Flags [.], ack 526, win 507, options [nop,nop,TS val 1432028570 ecr 2850960155], length 0
23:54:17.940556 IP 123.127.237.41.47316 > ubuntu-s-1vcpu-1gb-tor1-01.ssh: Flags [P.], seq 526:578, ack 1378, win 262, options [nop,nop,TS val 2850960221 ecr 1432028570], length 52
23:54:17.940597 IP ubuntu-s-1vcpu-1gb-tor1-01.ssh > 123.127.237.41.47316: Flags [.], ack 578, win 507, options [nop,nop,TS val 1432028836 ecr 2850960221], length 0
23:54:17.940841 IP ubuntu-s-1vcpu-1gb-tor1-01.ssh > 123.127.237.41.47316: Flags [P.], seq 1378:1430, ack 578, win 507, options [nop,nop,TS val 1432028836 ecr 2850960221], length 52
23:54:18.220405 IP 123.127.237.41.47316 > ubuntu-s-1vcpu-1gb-tor1-01.ssh: Flags [P.], seq 578:662, ack 1430, win 262, options [nop,nop,TS val 2850960291 ecr 1432028836], length 84
23:54:18.263993 IP ubuntu-s-1vcpu-1gb-tor1-01.ssh > 123.127.237.41.47316: Flags [.], ack 662, win 507, options [nop,nop,TS val 1432029159 ecr 2850960291], length 0
23:54:21.414161 IP 162.0.214.69.45128 > ubuntu-s-1vcpu-1gb-tor1-01.ssh: Flags [S], seq 1613502348, win 64240, options [mss 1420,sackOK,TS val 1269479398 ecr 0,nop,wscale 7], length 0
23:54:21.414221 IP ubuntu-s-1vcpu-1gb-tor1-01.ssh > 162.0.214.69.45128: Flags [S.], seq 255288621, ack 1613502349, win 65160, options [mss 1460,sackOK,TS val 3666759127 ecr 1269479398,nop,wscale 7], length 0
23:54:21.480822 IP 162.0.214.69.45128 > ubuntu-s-1vcpu-1gb-tor1-01.ssh: Flags [.], ack 1, win 502, options [nop,nop,TS val 1269479465 ecr 3666759127], length 0
23:54:21.497523 IP ubuntu-s-1vcpu-1gb-tor1-01.ssh > 123.127.237.41.47316: Flags [P.], seq 1430:1498, ack 662, win 507, options [nop,nop,TS val 1432032393 ecr 2850960291], length 68
23:54:21.502893 IP ubuntu-s-1vcpu-1gb-tor1-01.ssh > 162.0.214.69.45128: Flags [P.], seq 1:42, ack 1, win 510, options [nop,nop,TS val 3666759215 ecr 1269479465], length 41
23:54:21.569088 IP 162.0.214.69.45128 > ubuntu-s-1vcpu-1gb-tor1-01.ssh: Flags [.], ack 42, win 502, options [nop,nop,TS val 1269479554 ecr 3666759215], length 0
23:54:21.569088 IP 162.0.214.69.45128 > ubuntu-s-1vcpu-1gb-tor1-01.ssh: Flags [P.], seq 1:22, ack 42, win 502, options [nop,nop,TS val 1269479554 ecr 3666759215], length 21
23:54:21.569140 IP ubuntu-s-1vcpu-1gb-tor1-01.ssh > 162.0.214.69.45128: Flags [.], ack 22, win 510, options [nop,nop,TS val 3666759282 ecr 1269479554], length 0
23:54:21.571643 IP ubuntu-s-1vcpu-1gb-tor1-01.ssh > 162.0.214.69.45128: Flags [P.], seq 42:1098, ack 22, win 510, options [nop,nop,TS val 3666759284 ecr 1269479554], length 1056
23:54:21.637780 IP 162.0.214.69.45128 > ubuntu-s-1vcpu-1gb-tor1-01.ssh: Flags [.], ack 1098, win 501, options [nop,nop,TS val 1269479622 ecr 3666759284], length 0
23:54:21.637928 IP 162.0.214.69.45128 > ubuntu-s-1vcpu-1gb-tor1-01.ssh: Flags [P.], seq 22:462, ack 1098, win 501, options [nop,nop,TS val 1269479623 ecr 3666759284], length 440
23:54:21.637953 IP ubuntu-s-1vcpu-1gb-tor1-01.ssh > 162.0.214.69.45128: Flags [.], ack 462, win 507, options [nop,nop,TS val 3666759350 ecr 1269479623], length 0
23:54:21.704107 IP 162.0.214.69.45128 > ubuntu-s-1vcpu-1gb-tor1-01.ssh: Flags [P.], seq 462:510, ack 1098, win 501, options [nop,nop,TS val 1269479689 ecr 3666759350], length 48
23:54:21.704147 IP ubuntu-s-1vcpu-1gb-tor1-01.ssh > 162.0.214.69.45128: Flags [.], ack 510, win 507, options [nop,nop,TS val 3666759417 ecr 1269479689], length 0
23:54:21.715003 IP ubuntu-s-1vcpu-1gb-tor1-01.ssh > 162.0.214.69.45128: Flags [P.], seq 1098:1378, ack 510, win 507, options [nop,nop,TS val 3666759427 ecr 1269479689], length 280
23:54:21.734370 IP 123.127.237.41.47316 > ubuntu-s-1vcpu-1gb-tor1-01.ssh: Flags [P.], seq 662:714, ack 1498, win 262, options [nop,nop,TS val 2850961170 ecr 1432032393], length 52
23:54:21.734370 IP 123.127.237.41.47316 > ubuntu-s-1vcpu-1gb-tor1-01.ssh: Flags [F.], seq 714, ack 1498, win 262, options [nop,nop,TS val 2850961170 ecr 1432032393], length 0
23:54:21.734405 IP ubuntu-s-1vcpu-1gb-tor1-01.ssh > 123.127.237.41.47316: Flags [.], ack 714, win 507, options [nop,nop,TS val 1432032630 ecr 2850961170], length 0
23:54:21.737469 IP ubuntu-s-1vcpu-1gb-tor1-01.ssh > 123.127.237.41.47316: Flags [F.], seq 1498, ack 715, win 507, options [nop,nop,TS val 1432032633 ecr 2850961170], length 0
23:54:21.781187 IP 162.0.214.69.45128 > ubuntu-s-1vcpu-1gb-tor1-01.ssh: Flags [.], ack 1378, win 501, options [nop,nop,TS val 1269479766 ecr 3666759427], length 0
23:54:21.783030 IP 162.0.214.69.45128 > ubuntu-s-1vcpu-1gb-tor1-01.ssh: Flags [P.], seq 510:526, ack 1378, win 501, options [nop,nop,TS val 1269479768 ecr 3666759427], length 16
23:54:21.783059 IP ubuntu-s-1vcpu-1gb-tor1-01.ssh > 162.0.214.69.45128: Flags [.], ack 526, win 507, options [nop,nop,TS val 3666759495 ecr 1269479768], length 0
23:54:21.849189 IP 162.0.214.69.45128 > ubuntu-s-1vcpu-1gb-tor1-01.ssh: Flags [P.], seq 526:578, ack 1378, win 501, options [nop,nop,TS val 1269479834 ecr 3666759495], length 52
23:54:21.849238 IP ubuntu-s-1vcpu-1gb-tor1-01.ssh > 162.0.214.69.45128: Flags [.], ack 578, win 507, options [nop,nop,TS val 3666759562 ecr 1269479834], length 0
23:54:21.849405 IP ubuntu-s-1vcpu-1gb-tor1-01.ssh > 162.0.214.69.45128: Flags [P.], seq 1378:1430, ack 578, win 507, options [nop,nop,TS val 3666759562 ecr 1269479834], length 52
23:54:21.915533 IP 162.0.214.69.45128 > ubuntu-s-1vcpu-1gb-tor1-01.ssh: Flags [P.], seq 578:662, ack 1430, win 501, options [nop,nop,TS val 1269479900 ecr 3666759562], length 84
23:54:21.956009 IP ubuntu-s-1vcpu-1gb-tor1-01.ssh > 162.0.214.69.45128: Flags [.], ack 662, win 507, options [nop,nop,TS val 3666759668 ecr 1269479900], length 0
23:54:21.984724 IP 123.127.237.41.47316 > ubuntu-s-1vcpu-1gb-tor1-01.ssh: Flags [.], ack 1499, win 262, options [nop,nop,TS val 2850961232 ecr 1432032633], length 0
23:54:25.192731 IP ubuntu-s-1vcpu-1gb-tor1-01.ssh > 162.0.214.69.45128: Flags [P.], seq 1430:1498, ack 662, win 507, options [nop,nop,TS val 3666762905 ecr 1269479900], length 68
23:54:25.259024 IP 162.0.214.69.45128 > ubuntu-s-1vcpu-1gb-tor1-01.ssh: Flags [P.], seq 662:714, ack 1498, win 501, options [nop,nop,TS val 1269483244 ecr 3666762905], length 52
23:54:25.259024 IP 162.0.214.69.45128 > ubuntu-s-1vcpu-1gb-tor1-01.ssh: Flags [F.], seq 714, ack 1498, win 501, options [nop,nop,TS val 1269483244 ecr 3666762905], length 0
23:54:25.259072 IP ubuntu-s-1vcpu-1gb-tor1-01.ssh > 162.0.214.69.45128: Flags [.], ack 714, win 507, options [nop,nop,TS val 3666762971 ecr 1269483244], length 0
23:54:25.262571 IP ubuntu-s-1vcpu-1gb-tor1-01.ssh > 162.0.214.69.45128: Flags [F.], seq 1498, ack 715, win 507, options [nop,nop,TS val 3666762975 ecr 1269483244], length 0
23:54:25.328651 IP 162.0.214.69.45128 > ubuntu-s-1vcpu-1gb-tor1-01.ssh: Flags [.], ack 1499, win 501, options [nop,nop,TS val 1269483313 ecr 3666762975], length 0
23:54:26.477808 IP 20.84.56.71.53936 > ubuntu-s-1vcpu-1gb-tor1-01.ssh: Flags [S], seq 193654253, win 29200, options [mss 1440,sackOK,TS val 279235342 ecr 0,nop,wscale 7], length 0
23:54:26.477881 IP ubuntu-s-1vcpu-1gb-tor1-01.ssh > 20.84.56.71.53936: Flags [S.], seq 1196816000, ack 193654254, win 65160, options [mss 1460,sackOK,TS val 262242342 ecr 279235342,nop,wscale 7], length 0
23:54:26.502501 IP 20.84.56.71.53936 > ubuntu-s-1vcpu-1gb-tor1-01.ssh: Flags [.], ack 1, win 229, options [nop,nop,TS val 279235349 ecr 262242342], length 0
23:54:26.523475 IP ubuntu-s-1vcpu-1gb-tor1-01.ssh > 20.84.56.71.53936: Flags [P.], seq 1:42, ack 1, win 510, options [nop,nop,TS val 262242388 ecr 279235349], length 41
23:54:26.547748 IP 20.84.56.71.53936 > ubuntu-s-1vcpu-1gb-tor1-01.ssh: Flags [.], ack 42, win 229, options [nop,nop,TS val 279235360 ecr 262242388], length 0
23:54:26.548345 IP 20.84.56.71.53936 > ubuntu-s-1vcpu-1gb-tor1-01.ssh: Flags [P.], seq 1:22, ack 42, win 229, options [nop,nop,TS val 279235360 ecr 262242388], length 21
23:54:26.548370 IP ubuntu-s-1vcpu-1gb-tor1-01.ssh > 20.84.56.71.53936: Flags [.], ack 22, win 510, options [nop,nop,TS val 262242413 ecr 279235360], length 0
23:54:26.551065 IP ubuntu-s-1vcpu-1gb-tor1-01.ssh > 20.84.56.71.53936: Flags [P.], seq 42:1098, ack 22, win 510, options [nop,nop,TS val 262242415 ecr 279235360], length 1056
23:54:26.575599 IP 20.84.56.71.53936 > ubuntu-s-1vcpu-1gb-tor1-01.ssh: Flags [P.], seq 22:462, ack 1098, win 251, options [nop,nop,TS val 279235367 ecr 262242415], length 440
23:54:26.575674 IP ubuntu-s-1vcpu-1gb-tor1-01.ssh > 20.84.56.71.53936: Flags [.], ack 462, win 507, options [nop,nop,TS val 262242440 ecr 279235367], length 0
23:54:26.599742 IP 20.84.56.71.53936 > ubuntu-s-1vcpu-1gb-tor1-01.ssh: Flags [P.], seq 462:510, ack 1098, win 251, options [nop,nop,TS val 279235373 ecr 262242440], length 48
23:54:26.599783 IP ubuntu-s-1vcpu-1gb-tor1-01.ssh > 20.84.56.71.53936: Flags [.], ack 510, win 507, options [nop,nop,TS val 262242464 ecr 279235373], length 0
23:54:26.611821 IP ubuntu-s-1vcpu-1gb-tor1-01.ssh > 20.84.56.71.53936: Flags [P.], seq 1098:1378, ack 510, win 507, options [nop,nop,TS val 262242476 ecr 279235373], length 280
23:54:26.640208 IP 20.84.56.71.53936 > ubuntu-s-1vcpu-1gb-tor1-01.ssh: Flags [P.], seq 510:526, ack 1378, win 268, options [nop,nop,TS val 279235383 ecr 262242476], length 16
23:54:26.640285 IP ubuntu-s-1vcpu-1gb-tor1-01.ssh > 20.84.56.71.53936: Flags [.], ack 526, win 507, options [nop,nop,TS val 262242505 ecr 279235383], length 0
23:54:26.665320 IP 20.84.56.71.53936 > ubuntu-s-1vcpu-1gb-tor1-01.ssh: Flags [P.], seq 526:578, ack 1378, win 268, options [nop,nop,TS val 279235389 ecr 262242505], length 52
23:54:26.665358 IP ubuntu-s-1vcpu-1gb-tor1-01.ssh > 20.84.56.71.53936: Flags [.], ack 578, win 507, options [nop,nop,TS val 262242530 ecr 279235389], length 0
23:54:26.665561 IP ubuntu-s-1vcpu-1gb-tor1-01.ssh > 20.84.56.71.53936: Flags [P.], seq 1378:1430, ack 578, win 507, options [nop,nop,TS val 262242530 ecr 279235389], length 52
23:54:26.689646 IP 20.84.56.71.53936 > ubuntu-s-1vcpu-1gb-tor1-01.ssh: Flags [P.], seq 578:662, ack 1430, win 268, options [nop,nop,TS val 279235395 ecr 262242530], length 84
23:54:26.731984 IP ubuntu-s-1vcpu-1gb-tor1-01.ssh > 20.84.56.71.53936: Flags [.], ack 662, win 507, options [nop,nop,TS val 262242596 ecr 279235395], length 0
23:54:27.599638 IP 194.147.140.18.44041 > ubuntu-s-1vcpu-1gb-tor1-01.55664: Flags [S], seq 19589099, win 1024, length 0
23:54:27.599704 IP ubuntu-s-1vcpu-1gb-tor1-01.55664 > 194.147.140.18.44041: Flags [R.], seq 0, ack 19589100, win 0, length 0
23:54:27.703892 IP 194.147.140.18.44041 > ubuntu-s-1vcpu-1gb-tor1-01.55664: Flags [R], seq 19589100, win 1200, length 0
23:54:27.791795 IP 167.71.37.52.52118 > ubuntu-s-1vcpu-1gb-tor1-01.ssh: Flags [S], seq 2910025091, win 64240, options [mss 1460,sackOK,TS val 2825098515 ecr 0,nop,wscale 7], length 0
23:54:27.791869 IP ubuntu-s-1vcpu-1gb-tor1-01.ssh > 167.71.37.52.52118: Flags [S.], seq 2208900314, ack 2910025092, win 65160, options [mss 1460,sackOK,TS val 3665419687 ecr 2825098515,nop,wscale 7], length 0
23:54:27.887973 IP 167.71.37.52.52118 > ubuntu-s-1vcpu-1gb-tor1-01.ssh: Flags [.], ack 1, win 502, options [nop,nop,TS val 2825098612 ecr 3665419687], length 0
23:54:27.910013 IP ubuntu-s-1vcpu-1gb-tor1-01.ssh > 167.71.37.52.52118: Flags [P.], seq 1:42, ack 1, win 510, options [nop,nop,TS val 3665419805 ecr 2825098612], length 41
23:54:28.006149 IP 167.71.37.52.52118 > ubuntu-s-1vcpu-1gb-tor1-01.ssh: Flags [.], ack 42, win 502, options [nop,nop,TS val 2825098730 ecr 3665419805], length 0
23:54:28.006249 IP 167.71.37.52.52118 > ubuntu-s-1vcpu-1gb-tor1-01.ssh: Flags [P.], seq 1:22, ack 42, win 502, options [nop,nop,TS val 2825098730 ecr 3665419805], length 21
23:54:28.006290 IP ubuntu-s-1vcpu-1gb-tor1-01.ssh > 167.71.37.52.52118: Flags [.], ack 22, win 510, options [nop,nop,TS val 3665419902 ecr 2825098730], length 0
23:54:28.008908 IP ubuntu-s-1vcpu-1gb-tor1-01.ssh > 167.71.37.52.52118: Flags [P.], seq 42:1098, ack 22, win 510, options [nop,nop,TS val 3665419904 ecr 2825098730], length 1056
23:54:28.104603 IP 167.71.37.52.52118 > ubuntu-s-1vcpu-1gb-tor1-01.ssh: Flags [.], ack 1098, win 501, options [nop,nop,TS val 2825098828 ecr 3665419904], length 0
23:54:28.104603 IP 167.71.37.52.52118 > ubuntu-s-1vcpu-1gb-tor1-01.ssh: Flags [P.], seq 22:462, ack 1098, win 501, options [nop,nop,TS val 2825098828 ecr 3665419904], length 440
23:54:28.104661 IP ubuntu-s-1vcpu-1gb-tor1-01.ssh > 167.71.37.52.52118: Flags [.], ack 462, win 507, options [nop,nop,TS val 3665420000 ecr 2825098828], length 0
23:54:28.200331 IP 167.71.37.52.52118 > ubuntu-s-1vcpu-1gb-tor1-01.ssh: Flags [P.], seq 462:510, ack 1098, win 501, options [nop,nop,TS val 2825098924 ecr 3665420000], length 48
23:54:28.200411 IP ubuntu-s-1vcpu-1gb-tor1-01.ssh > 167.71.37.52.52118: Flags [.], ack 510, win 507, options [nop,nop,TS val 3665420096 ecr 2825098924], length 0
23:54:28.214419 IP ubuntu-s-1vcpu-1gb-tor1-01.ssh > 167.71.37.52.52118: Flags [P.], seq 1098:1378, ack 510, win 507, options [nop,nop,TS val 3665420110 ecr 2825098924], length 280
23:54:28.310135 IP 167.71.37.52.52118 > ubuntu-s-1vcpu-1gb-tor1-01.ssh: Flags [.], ack 1378, win 501, options [nop,nop,TS val 2825099034 ecr 3665420110], length 0
23:54:28.313390 IP 167.71.37.52.52118 > ubuntu-s-1vcpu-1gb-tor1-01.ssh: Flags [P.], seq 510:526, ack 1378, win 501, options [nop,nop,TS val 2825099037 ecr 3665420110], length 16
23:54:28.313419 IP ubuntu-s-1vcpu-1gb-tor1-01.ssh > 167.71.37.52.52118: Flags [.], ack 526, win 507, options [nop,nop,TS val 3665420209 ecr 2825099037], length 0
23:54:28.409091 IP 167.71.37.52.52118 > ubuntu-s-1vcpu-1gb-tor1-01.ssh: Flags [P.], seq 526:578, ack 1378, win 501, options [nop,nop,TS val 2825099133 ecr 3665420209], length 52
23:54:28.409142 IP ubuntu-s-1vcpu-1gb-tor1-01.ssh > 167.71.37.52.52118: Flags [.], ack 578, win 507, options [nop,nop,TS val 3665420305 ecr 2825099133], length 0
23:54:28.409392 IP ubuntu-s-1vcpu-1gb-tor1-01.ssh > 167.71.37.52.52118: Flags [P.], seq 1378:1430, ack 578, win 507, options [nop,nop,TS val 3665420305 ecr 2825099133], length 52
23:54:28.507299 IP 167.71.37.52.52118 > ubuntu-s-1vcpu-1gb-tor1-01.ssh: Flags [P.], seq 578:662, ack 1430, win 501, options [nop,nop,TS val 2825099231 ecr 3665420305], length 84
23:54:28.548087 IP ubuntu-s-1vcpu-1gb-tor1-01.ssh > 167.71.37.52.52118: Flags [.], ack 662, win 507, options [nop,nop,TS val 3665420443 ecr 2825099231], length 0
23:54:29.966921 IP ubuntu-s-1vcpu-1gb-tor1-01.ssh > 20.84.56.71.53936: Flags [P.], seq 1430:1498, ack 662, win 507, options [nop,nop,TS val 262245831 ecr 279235395], length 68
23:54:29.994829 IP 20.84.56.71.53936 > ubuntu-s-1vcpu-1gb-tor1-01.ssh: Flags [P.], seq 662:714, ack 1498, win 268, options [nop,nop,TS val 279236222 ecr 262245831], length 52
23:54:29.994829 IP 20.84.56.71.53936 > ubuntu-s-1vcpu-1gb-tor1-01.ssh: Flags [F.], seq 714, ack 1498, win 268, options [nop,nop,TS val 279236222 ecr 262245831], length 0
23:54:29.994911 IP ubuntu-s-1vcpu-1gb-tor1-01.ssh > 20.84.56.71.53936: Flags [.], ack 714, win 507, options [nop,nop,TS val 262245859 ecr 279236222], length 0
23:54:29.997978 IP ubuntu-s-1vcpu-1gb-tor1-01.ssh > 20.84.56.71.53936: Flags [F.], seq 1498, ack 715, win 507, options [nop,nop,TS val 262245862 ecr 279236222], length 0
23:54:30.022100 IP 20.84.56.71.53936 > ubuntu-s-1vcpu-1gb-tor1-01.ssh: Flags [.], ack 1499, win 268, options [nop,nop,TS val 279236229 ecr 262245862], length 0
23:54:31.784627 IP ubuntu-s-1vcpu-1gb-tor1-01.ssh > 167.71.37.52.52118: Flags [P.], seq 1430:1498, ack 662, win 507, options [nop,nop,TS val 3665423680 ecr 2825099231], length 68
23:54:31.880438 IP 167.71.37.52.52118 > ubuntu-s-1vcpu-1gb-tor1-01.ssh: Flags [P.], seq 662:714, ack 1498, win 501, options [nop,nop,TS val 2825102604 ecr 3665423680], length 52
23:54:31.880439 IP 167.71.37.52.52118 > ubuntu-s-1vcpu-1gb-tor1-01.ssh: Flags [F.], seq 714, ack 1498, win 501, options [nop,nop,TS val 2825102604 ecr 3665423680], length 0
23:54:31.880497 IP ubuntu-s-1vcpu-1gb-tor1-01.ssh > 167.71.37.52.52118: Flags [.], ack 714, win 507, options [nop,nop,TS val 3665423776 ecr 2825102604], length 0
23:54:31.882785 IP ubuntu-s-1vcpu-1gb-tor1-01.ssh > 167.71.37.52.52118: Flags [F.], seq 1498, ack 715, win 507, options [nop,nop,TS val 3665423778 ecr 2825102604], length 0
23:54:31.978499 IP 167.71.37.52.52118 > ubuntu-s-1vcpu-1gb-tor1-01.ssh: Flags [.], ack 1499, win 501, options [nop,nop,TS val 2825102702 ecr 3665423778], length 0
23:54:39.639264 IP vps-86881849.vps.ovh.net.40400 > ubuntu-s-1vcpu-1gb-tor1-01.ssh: Flags [S], seq 269508714, win 29200, options [mss 1460,sackOK,TS val 3329940110 ecr 0,nop,wscale 7], length 0
23:54:39.639334 IP ubuntu-s-1vcpu-1gb-tor1-01.ssh > vps-86881849.vps.ovh.net.40400: Flags [S.], seq 3357494294, ack 269508715, win 65160, options [mss 1460,sackOK,TS val 1529322324 ecr 3329940110,nop,wscale 7], length 0
23:54:39.789653 IP vps-86881849.vps.ovh.net.40400 > ubuntu-s-1vcpu-1gb-tor1-01.ssh: Flags [.], ack 1, win 229, options [nop,nop,TS val 3329940261 ecr 1529322324], length 0
23:54:39.811468 IP ubuntu-s-1vcpu-1gb-tor1-01.ssh > vps-86881849.vps.ovh.net.40400: Flags [P.], seq 1:42, ack 1, win 510, options [nop,nop,TS val 1529322496 ecr 3329940261], length 41
23:54:40.000670 IP vps-86881849.vps.ovh.net.40400 > ubuntu-s-1vcpu-1gb-tor1-01.ssh: Flags [.], ack 42, win 229, options [nop,nop,TS val 3329940472 ecr 1529322496], length 0
23:54:40.012780 IP vps-86881849.vps.ovh.net.40400 > ubuntu-s-1vcpu-1gb-tor1-01.ssh: Flags [P.], seq 1:22, ack 42, win 229, options [nop,nop,TS val 3329940484 ecr 1529322496], length 21
23:54:40.012826 IP ubuntu-s-1vcpu-1gb-tor1-01.ssh > vps-86881849.vps.ovh.net.40400: Flags [.], ack 22, win 510, options [nop,nop,TS val 1529322697 ecr 3329940484], length 0
23:54:40.015536 IP ubuntu-s-1vcpu-1gb-tor1-01.ssh > vps-86881849.vps.ovh.net.40400: Flags [P.], seq 42:1098, ack 22, win 510, options [nop,nop,TS val 1529322700 ecr 3329940484], length 1056
23:54:40.180888 IP vps-86881849.vps.ovh.net.40400 > ubuntu-s-1vcpu-1gb-tor1-01.ssh: Flags [P.], seq 22:462, ack 1098, win 245, options [nop,nop,TS val 3329940652 ecr 1529322700], length 440
23:54:40.180988 IP ubuntu-s-1vcpu-1gb-tor1-01.ssh > vps-86881849.vps.ovh.net.40400: Flags [.], ack 462, win 507, options [nop,nop,TS val 1529322865 ecr 3329940652], length 0
23:54:40.385242 IP vps-86881849.vps.ovh.net.40400 > ubuntu-s-1vcpu-1gb-tor1-01.ssh: Flags [P.], seq 462:510, ack 1098, win 245, options [nop,nop,TS val 3329940857 ecr 1529322865], length 48
23:54:40.385297 IP ubuntu-s-1vcpu-1gb-tor1-01.ssh > vps-86881849.vps.ovh.net.40400: Flags [.], ack 510, win 507, options [nop,nop,TS val 1529323070 ecr 3329940857], length 0
23:54:40.396570 IP ubuntu-s-1vcpu-1gb-tor1-01.ssh > vps-86881849.vps.ovh.net.40400: Flags [P.], seq 1098:1378, ack 510, win 507, options [nop,nop,TS val 1529323081 ecr 3329940857], length 280
23:54:40.579415 IP vps-86881849.vps.ovh.net.40400 > ubuntu-s-1vcpu-1gb-tor1-01.ssh: Flags [P.], seq 510:526, ack 1378, win 262, options [nop,nop,TS val 3329941051 ecr 1529323081], length 16
23:54:40.579497 IP ubuntu-s-1vcpu-1gb-tor1-01.ssh > vps-86881849.vps.ovh.net.40400: Flags [.], ack 526, win 507, options [nop,nop,TS val 1529323264 ecr 3329941051], length 0
23:54:40.766443 IP vps-86881849.vps.ovh.net.40400 > ubuntu-s-1vcpu-1gb-tor1-01.ssh: Flags [P.], seq 526:578, ack 1378, win 262, options [nop,nop,TS val 3329941238 ecr 1529323264], length 52
23:54:40.766500 IP ubuntu-s-1vcpu-1gb-tor1-01.ssh > vps-86881849.vps.ovh.net.40400: Flags [.], ack 578, win 507, options [nop,nop,TS val 1529323451 ecr 3329941238], length 0
23:54:40.766758 IP ubuntu-s-1vcpu-1gb-tor1-01.ssh > vps-86881849.vps.ovh.net.40400: Flags [P.], seq 1378:1430, ack 578, win 507, options [nop,nop,TS val 1529323451 ecr 3329941238], length 52
23:54:40.963003 IP vps-86881849.vps.ovh.net.40400 > ubuntu-s-1vcpu-1gb-tor1-01.ssh: Flags [P.], seq 578:662, ack 1430, win 262, options [nop,nop,TS val 3329941434 ecr 1529323451], length 84
23:54:41.003996 IP ubuntu-s-1vcpu-1gb-tor1-01.ssh > vps-86881849.vps.ovh.net.40400: Flags [.], ack 662, win 507, options [nop,nop,TS val 1529323688 ecr 3329941434], length 0
23:54:44.240321 IP ubuntu-s-1vcpu-1gb-tor1-01.ssh > vps-86881849.vps.ovh.net.40400: Flags [P.], seq 1430:1498, ack 662, win 507, options [nop,nop,TS val 1529326925 ecr 3329941434], length 68
23:54:44.336345 IP vps-86881849.vps.ovh.net.40400 > ubuntu-s-1vcpu-1gb-tor1-01.ssh: Flags [P.], seq 662:714, ack 1498, win 262, options [nop,nop,TS val 3329944808 ecr 1529326925], length 52
23:54:44.336346 IP vps-86881849.vps.ovh.net.40400 > ubuntu-s-1vcpu-1gb-tor1-01.ssh: Flags [F.], seq 714, ack 1498, win 262, options [nop,nop,TS val 3329944808 ecr 1529326925], length 0
23:54:44.336400 IP ubuntu-s-1vcpu-1gb-tor1-01.ssh > vps-86881849.vps.ovh.net.40400: Flags [.], ack 714, win 507, options [nop,nop,TS val 1529327021 ecr 3329944808], length 0
23:54:44.340135 IP ubuntu-s-1vcpu-1gb-tor1-01.ssh > vps-86881849.vps.ovh.net.40400: Flags [F.], seq 1498, ack 715, win 507, options [nop,nop,TS val 1529327025 ecr 3329944808], length 0
23:54:44.436420 IP vps-86881849.vps.ovh.net.40400 > ubuntu-s-1vcpu-1gb-tor1-01.ssh: Flags [.], ack 1499, win 262, options [nop,nop,TS val 3329944908 ecr 1529327025], length 0
23:54:46.015441 IP static-131-196-5-250.grsolucoestelecom.com.br.52588 > ubuntu-s-1vcpu-1gb-tor1-01.ssh: Flags [S], seq 1766323640, win 64240, options [mss 1420,sackOK,TS val 403040930 ecr 0,nop,wscale 7], length 0
23:54:46.015507 IP ubuntu-s-1vcpu-1gb-tor1-01.ssh > static-131-196-5-250.grsolucoestelecom.com.br.52588: Flags [S.], seq 1849630963, ack 1766323641, win 65160, options [mss 1460,sackOK,TS val 3692636995 ecr 403040930,nop,wscale 7], length 0
23:54:46.138045 IP static-131-196-5-250.grsolucoestelecom.com.br.52588 > ubuntu-s-1vcpu-1gb-tor1-01.ssh: Flags [.], ack 1, win 502, options [nop,nop,TS val 403041053 ecr 3692636995], length 0
23:54:46.159580 IP ubuntu-s-1vcpu-1gb-tor1-01.ssh > static-131-196-5-250.grsolucoestelecom.com.br.52588: Flags [P.], seq 1:42, ack 1, win 510, options [nop,nop,TS val 3692637139 ecr 403041053], length 41
23:54:46.281715 IP static-131-196-5-250.grsolucoestelecom.com.br.52588 > ubuntu-s-1vcpu-1gb-tor1-01.ssh: Flags [.], ack 42, win 502, options [nop,nop,TS val 403041196 ecr 3692637139], length 0
23:54:46.281716 IP static-131-196-5-250.grsolucoestelecom.com.br.52588 > ubuntu-s-1vcpu-1gb-tor1-01.ssh: Flags [P.], seq 1:22, ack 42, win 502, options [nop,nop,TS val 403041196 ecr 3692637139], length 21
23:54:46.281788 IP ubuntu-s-1vcpu-1gb-tor1-01.ssh > static-131-196-5-250.grsolucoestelecom.com.br.52588: Flags [.], ack 22, win 510, options [nop,nop,TS val 3692637261 ecr 403041196], length 0
23:54:46.284463 IP ubuntu-s-1vcpu-1gb-tor1-01.ssh > static-131-196-5-250.grsolucoestelecom.com.br.52588: Flags [P.], seq 42:1098, ack 22, win 510, options [nop,nop,TS val 3692637264 ecr 403041196], length 1056
23:54:46.406757 IP static-131-196-5-250.grsolucoestelecom.com.br.52588 > ubuntu-s-1vcpu-1gb-tor1-01.ssh: Flags [P.], seq 22:462, ack 1098, win 501, options [nop,nop,TS val 403041321 ecr 3692637264], length 440
23:54:46.406758 IP static-131-196-5-250.grsolucoestelecom.com.br.52588 > ubuntu-s-1vcpu-1gb-tor1-01.ssh: Flags [.], ack 1098, win 501, options [nop,nop,TS val 403041321 ecr 3692637264], length 0
23:54:46.406870 IP ubuntu-s-1vcpu-1gb-tor1-01.ssh > static-131-196-5-250.grsolucoestelecom.com.br.52588: Flags [.], ack 462, win 507, options [nop,nop,TS val 3692637386 ecr 403041321], length 0
23:54:46.406897 IP ubuntu-s-1vcpu-1gb-tor1-01.ssh > static-131-196-5-250.grsolucoestelecom.com.br.52588: Flags [.], ack 462, win 507, options [nop,nop,TS val 3692637386 ecr 403041321], length 0
23:54:46.567778 IP static-131-196-5-250.grsolucoestelecom.com.br.52588 > ubuntu-s-1vcpu-1gb-tor1-01.ssh: Flags [P.], seq 462:510, ack 1098, win 501, options [nop,nop,TS val 403041482 ecr 3692637386], length 48
23:54:46.567828 IP ubuntu-s-1vcpu-1gb-tor1-01.ssh > static-131-196-5-250.grsolucoestelecom.com.br.52588: Flags [.], ack 510, win 507, options [nop,nop,TS val 3692637547 ecr 403041482], length 0
23:54:46.578652 IP ubuntu-s-1vcpu-1gb-tor1-01.ssh > static-131-196-5-250.grsolucoestelecom.com.br.52588: Flags [P.], seq 1098:1378, ack 510, win 507, options [nop,nop,TS val 3692637558 ecr 403041482], length 280
23:54:46.700711 IP static-131-196-5-250.grsolucoestelecom.com.br.52588 > ubuntu-s-1vcpu-1gb-tor1-01.ssh: Flags [.], ack 1378, win 501, options [nop,nop,TS val 403041615 ecr 3692637558], length 0
23:54:47.825731 IP static-131-196-5-250.grsolucoestelecom.com.br.52588 > ubuntu-s-1vcpu-1gb-tor1-01.ssh: Flags [P.], seq 510:526, ack 1378, win 501, options [nop,nop,TS val 403042740 ecr 3692637558], length 16
23:54:47.825800 IP ubuntu-s-1vcpu-1gb-tor1-01.ssh > static-131-196-5-250.grsolucoestelecom.com.br.52588: Flags [.], ack 526, win 507, options [nop,nop,TS val 3692638805 ecr 403042740], length 0
23:54:48.086164 IP static-131-196-5-250.grsolucoestelecom.com.br.52588 > ubuntu-s-1vcpu-1gb-tor1-01.ssh: Flags [P.], seq 526:578, ack 1378, win 501, options [nop,nop,TS val 403043001 ecr 3692638805], length 52
23:54:48.086213 IP ubuntu-s-1vcpu-1gb-tor1-01.ssh > static-131-196-5-250.grsolucoestelecom.com.br.52588: Flags [.], ack 578, win 507, options [nop,nop,TS val 3692639066 ecr 403043001], length 0
23:54:48.086454 IP ubuntu-s-1vcpu-1gb-tor1-01.ssh > static-131-196-5-250.grsolucoestelecom.com.br.52588: Flags [P.], seq 1378:1430, ack 578, win 507, options [nop,nop,TS val 3692639066 ecr 403043001], length 52
23:54:48.208696 IP static-131-196-5-250.grsolucoestelecom.com.br.52588 > ubuntu-s-1vcpu-1gb-tor1-01.ssh: Flags [.], ack 1430, win 501, options [nop,nop,TS val 403043123 ecr 3692639066], length 0
23:54:48.217958 IP static-131-196-5-250.grsolucoestelecom.com.br.52588 > ubuntu-s-1vcpu-1gb-tor1-01.ssh: Flags [P.], seq 578:662, ack 1430, win 501, options [nop,nop,TS val 403043132 ecr 3692639066], length 84
23:54:48.260027 IP ubuntu-s-1vcpu-1gb-tor1-01.ssh > static-131-196-5-250.grsolucoestelecom.com.br.52588: Flags [.], ack 662, win 507, options [nop,nop,TS val 3692639239 ecr 403043132], length 0
23:54:51.495156 IP ubuntu-s-1vcpu-1gb-tor1-01.ssh > static-131-196-5-250.grsolucoestelecom.com.br.52588: Flags [P.], seq 1430:1498, ack 662, win 507, options [nop,nop,TS val 3692642475 ecr 403043132], length 68
23:54:51.620246 IP static-131-196-5-250.grsolucoestelecom.com.br.52588 > ubuntu-s-1vcpu-1gb-tor1-01.ssh: Flags [P.], seq 662:714, ack 1498, win 501, options [nop,nop,TS val 403046535 ecr 3692642475], length 52
23:54:51.620247 IP static-131-196-5-250.grsolucoestelecom.com.br.52588 > ubuntu-s-1vcpu-1gb-tor1-01.ssh: Flags [F.], seq 714, ack 1498, win 501, options [nop,nop,TS val 403046535 ecr 3692642475], length 0
23:54:51.620315 IP ubuntu-s-1vcpu-1gb-tor1-01.ssh > static-131-196-5-250.grsolucoestelecom.com.br.52588: Flags [.], ack 714, win 507, options [nop,nop,TS val 3692642600 ecr 403046535], length 0
23:54:51.624506 IP ubuntu-s-1vcpu-1gb-tor1-01.ssh > static-131-196-5-250.grsolucoestelecom.com.br.52588: Flags [F.], seq 1498, ack 715, win 507, options [nop,nop,TS val 3692642604 ecr 403046535], length 0
23:54:51.746661 IP static-131-196-5-250.grsolucoestelecom.com.br.52588 > ubuntu-s-1vcpu-1gb-tor1-01.ssh: Flags [.], ack 1499, win 501, options [nop,nop,TS val 403046661 ecr 3692642604], length 0
23:55:02.239840 IP 157.230.211.4.51640 > ubuntu-s-1vcpu-1gb-tor1-01.ms-wbt-server: Flags [S], seq 2552442549, win 1024, length 0
23:55:02.239901 IP ubuntu-s-1vcpu-1gb-tor1-01.ms-wbt-server > 157.230.211.4.51640: Flags [R.], seq 0, ack 2552442550, win 0, length 0
23:55:02.766223 IP 111.196.181.101.42378 > ubuntu-s-1vcpu-1gb-tor1-01.ssh: Flags [S], seq 1516435598, win 64240, options [mss 1440,sackOK,TS val 68437304 ecr 0,nop,wscale 7], length 0
23:55:02.766288 IP ubuntu-s-1vcpu-1gb-tor1-01.ssh > 111.196.181.101.42378: Flags [S.], seq 3211266625, ack 1516435599, win 65160, options [mss 1460,sackOK,TS val 16472187 ecr 68437304,nop,wscale 7], length 0
23:55:03.032295 IP 111.196.181.101.42378 > ubuntu-s-1vcpu-1gb-tor1-01.ssh: Flags [.], ack 1, win 502, options [nop,nop,TS val 68437573 ecr 16472187], length 0
23:55:03.056695 IP ubuntu-s-1vcpu-1gb-tor1-01.ssh > 111.196.181.101.42378: Flags [P.], seq 1:42, ack 1, win 510, options [nop,nop,TS val 16472477 ecr 68437573], length 41
23:55:03.333110 IP 111.196.181.101.42378 > ubuntu-s-1vcpu-1gb-tor1-01.ssh: Flags [.], ack 42, win 502, options [nop,nop,TS val 68437873 ecr 16472477], length 0
23:55:03.333111 IP 111.196.181.101.42378 > ubuntu-s-1vcpu-1gb-tor1-01.ssh: Flags [P.], seq 1:22, ack 42, win 502, options [nop,nop,TS val 68437873 ecr 16472477], length 21
23:55:03.333159 IP ubuntu-s-1vcpu-1gb-tor1-01.ssh > 111.196.181.101.42378: Flags [.], ack 22, win 510, options [nop,nop,TS val 16472754 ecr 68437873], length 0
23:55:03.336441 IP ubuntu-s-1vcpu-1gb-tor1-01.ssh > 111.196.181.101.42378: Flags [P.], seq 42:1098, ack 22, win 510, options [nop,nop,TS val 16472757 ecr 68437873], length 1056
23:55:03.358297 IP 139.59.80.88.40686 > ubuntu-s-1vcpu-1gb-tor1-01.ssh: Flags [S], seq 1180305374, win 29200, options [mss 1460,sackOK,TS val 728385663 ecr 0,nop,wscale 7], length 0
23:55:03.358347 IP ubuntu-s-1vcpu-1gb-tor1-01.ssh > 139.59.80.88.40686: Flags [S.], seq 1056985533, ack 1180305375, win 65160, options [mss 1460,sackOK,TS val 2961357574 ecr 728385663,nop,wscale 7], length 0
23:55:03.603156 IP 111.196.181.101.42378 > ubuntu-s-1vcpu-1gb-tor1-01.ssh: Flags [.], ack 1098, win 501, options [nop,nop,TS val 68438142 ecr 16472757], length 0
23:55:03.607269 IP 139.59.80.88.40686 > ubuntu-s-1vcpu-1gb-tor1-01.ssh: Flags [.], ack 1, win 229, options [nop,nop,TS val 728385725 ecr 2961357574], length 0
23:55:03.608081 IP 111.196.181.101.42378 > ubuntu-s-1vcpu-1gb-tor1-01.ssh: Flags [P.], seq 22:462, ack 1098, win 501, options [nop,nop,TS val 68438148 ecr 16472757], length 440
23:55:03.608110 IP ubuntu-s-1vcpu-1gb-tor1-01.ssh > 111.196.181.101.42378: Flags [.], ack 462, win 507, options [nop,nop,TS val 16473029 ecr 68438148], length 0
23:55:03.631423 IP ubuntu-s-1vcpu-1gb-tor1-01.ssh > 139.59.80.88.40686: Flags [P.], seq 1:42, ack 1, win 510, options [nop,nop,TS val 2961357847 ecr 728385725], length 41
23:55:03.718352 IP 182.73.147.154.42492 > ubuntu-s-1vcpu-1gb-tor1-01.ssh: Flags [S], seq 3267895708, win 64240, options [mss 1460,sackOK,TS val 3250414613 ecr 0,nop,wscale 7], length 0
23:55:03.718420 IP ubuntu-s-1vcpu-1gb-tor1-01.ssh > 182.73.147.154.42492: Flags [S.], seq 1778843560, ack 3267895709, win 65160, options [mss 1460,sackOK,TS val 4037805914 ecr 3250414613,nop,wscale 7], length 0
23:55:03.856666 IP 111.196.181.101.42378 > ubuntu-s-1vcpu-1gb-tor1-01.ssh: Flags [P.], seq 462:510, ack 1098, win 501, options [nop,nop,TS val 68438397 ecr 16473029], length 48
23:55:03.856704 IP ubuntu-s-1vcpu-1gb-tor1-01.ssh > 111.196.181.101.42378: Flags [.], ack 510, win 507, options [nop,nop,TS val 16473277 ecr 68438397], length 0
23:55:03.867567 IP ubuntu-s-1vcpu-1gb-tor1-01.ssh > 111.196.181.101.42378: Flags [P.], seq 1098:1378, ack 510, win 507, options [nop,nop,TS val 16473288 ecr 68438397], length 280
23:55:03.879927 IP 139.59.80.88.40686 > ubuntu-s-1vcpu-1gb-tor1-01.ssh: Flags [.], ack 42, win 229, options [nop,nop,TS val 728385793 ecr 2961357847], length 0
23:55:03.879984 IP 139.59.80.88.40686 > ubuntu-s-1vcpu-1gb-tor1-01.ssh: Flags [P.], seq 1:22, ack 42, win 229, options [nop,nop,TS val 728385794 ecr 2961357847], length 21
23:55:03.880005 IP ubuntu-s-1vcpu-1gb-tor1-01.ssh > 139.59.80.88.40686: Flags [.], ack 22, win 510, options [nop,nop,TS val 2961358095 ecr 728385794], length 0
23:55:03.882409 IP ubuntu-s-1vcpu-1gb-tor1-01.ssh > 139.59.80.88.40686: Flags [P.], seq 42:1098, ack 22, win 510, options [nop,nop,TS val 2961358098 ecr 728385794], length 1056
23:55:03.961217 IP 182.73.147.154.42492 > ubuntu-s-1vcpu-1gb-tor1-01.ssh: Flags [.], ack 1, win 502, options [nop,nop,TS val 3250414856 ecr 4037805914], length 0
23:55:03.982793 IP ubuntu-s-1vcpu-1gb-tor1-01.ssh > 182.73.147.154.42492: Flags [P.], seq 1:42, ack 1, win 510, options [nop,nop,TS val 4037806178 ecr 3250414856], length 41
23:55:04.131085 IP 139.59.80.88.40686 > ubuntu-s-1vcpu-1gb-tor1-01.ssh: Flags [P.], seq 22:462, ack 1098, win 245, options [nop,nop,TS val 728385856 ecr 2961358098], length 440
23:55:04.131165 IP ubuntu-s-1vcpu-1gb-tor1-01.ssh > 139.59.80.88.40686: Flags [.], ack 462, win 507, options [nop,nop,TS val 2961358347 ecr 728385856], length 0
23:55:04.138630 IP 111.196.181.101.42378 > ubuntu-s-1vcpu-1gb-tor1-01.ssh: Flags [.], ack 1378, win 501, options [nop,nop,TS val 68438678 ecr 16473288], length 0
23:55:04.138842 IP 111.196.181.101.42378 > ubuntu-s-1vcpu-1gb-tor1-01.ssh: Flags [P.], seq 510:526, ack 1378, win 501, options [nop,nop,TS val 68438679 ecr 16473288], length 16
23:55:04.138860 IP ubuntu-s-1vcpu-1gb-tor1-01.ssh > 111.196.181.101.42378: Flags [.], ack 526, win 507, options [nop,nop,TS val 16473559 ecr 68438679], length 0
23:55:04.223575 IP 182.73.147.154.42492 > ubuntu-s-1vcpu-1gb-tor1-01.ssh: Flags [.], ack 42, win 502, options [nop,nop,TS val 3250415119 ecr 4037806178], length 0
23:55:04.223652 IP 182.73.147.154.42492 > ubuntu-s-1vcpu-1gb-tor1-01.ssh: Flags [P.], seq 1:22, ack 42, win 502, options [nop,nop,TS val 3250415119 ecr 4037806178], length 21
23:55:04.223670 IP ubuntu-s-1vcpu-1gb-tor1-01.ssh > 182.73.147.154.42492: Flags [.], ack 22, win 510, options [nop,nop,TS val 4037806419 ecr 3250415119], length 0
23:55:04.226262 IP ubuntu-s-1vcpu-1gb-tor1-01.ssh > 182.73.147.154.42492: Flags [P.], seq 42:1098, ack 22, win 510, options [nop,nop,TS val 4037806422 ecr 3250415119], length 1056
23:55:04.379679 IP 139.59.80.88.40686 > ubuntu-s-1vcpu-1gb-tor1-01.ssh: Flags [P.], seq 462:510, ack 1098, win 245, options [nop,nop,TS val 728385918 ecr 2961358347], length 48
23:55:04.379720 IP ubuntu-s-1vcpu-1gb-tor1-01.ssh > 139.59.80.88.40686: Flags [.], ack 510, win 507, options [nop,nop,TS val 2961358595 ecr 728385918], length 0
23:55:04.390986 IP ubuntu-s-1vcpu-1gb-tor1-01.ssh > 139.59.80.88.40686: Flags [P.], seq 1098:1378, ack 510, win 507, options [nop,nop,TS val 2961358606 ecr 728385918], length 280
23:55:04.414957 IP 111.196.181.101.42378 > ubuntu-s-1vcpu-1gb-tor1-01.ssh: Flags [P.], seq 526:578, ack 1378, win 501, options [nop,nop,TS val 68438955 ecr 16473559], length 52
23:55:04.415010 IP ubuntu-s-1vcpu-1gb-tor1-01.ssh > 111.196.181.101.42378: Flags [.], ack 578, win 507, options [nop,nop,TS val 16473835 ecr 68438955], length 0
23:55:04.415277 IP ubuntu-s-1vcpu-1gb-tor1-01.ssh > 111.196.181.101.42378: Flags [P.], seq 1378:1430, ack 578, win 507, options [nop,nop,TS val 16473836 ecr 68438955], length 52
23:55:04.469764 IP 182.73.147.154.42492 > ubuntu-s-1vcpu-1gb-tor1-01.ssh: Flags [P.], seq 22:462, ack 1098, win 501, options [nop,nop,TS val 3250415364 ecr 4037806422], length 440
23:55:04.469856 IP ubuntu-s-1vcpu-1gb-tor1-01.ssh > 182.73.147.154.42492: Flags [.], ack 462, win 507, options [nop,nop,TS val 4037806665 ecr 3250415364], length 0
23:55:04.676072 IP 139.59.80.88.40686 > ubuntu-s-1vcpu-1gb-tor1-01.ssh: Flags [.], ack 1378, win 262, options [nop,nop,TS val 728385993 ecr 2961358606], length 0
23:55:04.680851 IP 111.196.181.101.42378 > ubuntu-s-1vcpu-1gb-tor1-01.ssh: Flags [P.], seq 578:662, ack 1430, win 501, options [nop,nop,TS val 68439221 ecr 16473836], length 84
23:55:04.711998 IP 182.73.147.154.42492 > ubuntu-s-1vcpu-1gb-tor1-01.ssh: Flags [P.], seq 462:510, ack 1098, win 501, options [nop,nop,TS val 3250415607 ecr 4037806665], length 48
23:55:04.712032 IP ubuntu-s-1vcpu-1gb-tor1-01.ssh > 182.73.147.154.42492: Flags [.], ack 510, win 507, options [nop,nop,TS val 4037806907 ecr 3250415607], length 0
23:55:04.722879 IP ubuntu-s-1vcpu-1gb-tor1-01.ssh > 182.73.147.154.42492: Flags [P.], seq 1098:1378, ack 510, win 507, options [nop,nop,TS val 4037806918 ecr 3250415607], length 280
23:55:04.724003 IP ubuntu-s-1vcpu-1gb-tor1-01.ssh > 111.196.181.101.42378: Flags [.], ack 662, win 507, options [nop,nop,TS val 16474144 ecr 68439221], length 0
23:55:04.836141 IP 139.59.80.88.40686 > ubuntu-s-1vcpu-1gb-tor1-01.ssh: Flags [P.], seq 510:526, ack 1378, win 262, options [nop,nop,TS val 728386033 ecr 2961358606], length 16
23:55:04.836180 IP ubuntu-s-1vcpu-1gb-tor1-01.ssh > 139.59.80.88.40686: Flags [.], ack 526, win 507, options [nop,nop,TS val 2961359052 ecr 728386033], length 0
23:55:04.968872 IP 182.73.147.154.42492 > ubuntu-s-1vcpu-1gb-tor1-01.ssh: Flags [P.], seq 510:526, ack 1378, win 501, options [nop,nop,TS val 3250415864 ecr 4037806918], length 16
23:55:04.968921 IP ubuntu-s-1vcpu-1gb-tor1-01.ssh > 182.73.147.154.42492: Flags [.], ack 526, win 507, options [nop,nop,TS val 4037807164 ecr 3250415864], length 0
23:55:05.084661 IP 139.59.80.88.40686 > ubuntu-s-1vcpu-1gb-tor1-01.ssh: Flags [P.], seq 526:578, ack 1378, win 262, options [nop,nop,TS val 728386095 ecr 2961359052], length 52
23:55:05.084725 IP ubuntu-s-1vcpu-1gb-tor1-01.ssh > 139.59.80.88.40686: Flags [.], ack 578, win 507, options [nop,nop,TS val 2961359300 ecr 728386095], length 0
23:55:05.084957 IP ubuntu-s-1vcpu-1gb-tor1-01.ssh > 139.59.80.88.40686: Flags [P.], seq 1378:1430, ack 578, win 507, options [nop,nop,TS val 2961359300 ecr 728386095], length 52
23:55:05.209776 IP 182.73.147.154.42492 > ubuntu-s-1vcpu-1gb-tor1-01.ssh: Flags [P.], seq 526:578, ack 1378, win 501, options [nop,nop,TS val 3250416105 ecr 4037807164], length 52
23:55:05.209829 IP ubuntu-s-1vcpu-1gb-tor1-01.ssh > 182.73.147.154.42492: Flags [.], ack 578, win 507, options [nop,nop,TS val 4037807405 ecr 3250416105], length 0
23:55:05.210138 IP ubuntu-s-1vcpu-1gb-tor1-01.ssh > 182.73.147.154.42492: Flags [P.], seq 1378:1430, ack 578, win 507, options [nop,nop,TS val 4037807406 ecr 3250416105], length 52
23:55:05.333353 IP 139.59.80.88.40686 > ubuntu-s-1vcpu-1gb-tor1-01.ssh: Flags [.], ack 1430, win 262, options [nop,nop,TS val 728386157 ecr 2961359300], length 0
23:55:05.333353 IP 139.59.80.88.40686 > ubuntu-s-1vcpu-1gb-tor1-01.ssh: Flags [P.], seq 578:662, ack 1430, win 262, options [nop,nop,TS val 728386157 ecr 2961359300], length 84
23:55:05.376167 IP ubuntu-s-1vcpu-1gb-tor1-01.ssh > 139.59.80.88.40686: Flags [.], ack 662, win 507, options [nop,nop,TS val 2961359592 ecr 728386157], length 0
23:55:05.453229 IP 182.73.147.154.42492 > ubuntu-s-1vcpu-1gb-tor1-01.ssh: Flags [P.], seq 578:662, ack 1430, win 501, options [nop,nop,TS val 3250416348 ecr 4037807406], length 84
23:55:05.496002 IP ubuntu-s-1vcpu-1gb-tor1-01.ssh > 182.73.147.154.42492: Flags [.], ack 662, win 507, options [nop,nop,TS val 4037807691 ecr 3250416348], length 0
23:55:05.932659 IP 206.189.234.114.56312 > ubuntu-s-1vcpu-1gb-tor1-01.ssh: Flags [S], seq 2049901112, win 29200, options [mss 1460,sackOK,TS val 2499104609 ecr 0,nop,wscale 7], length 0
23:55:05.932718 IP ubuntu-s-1vcpu-1gb-tor1-01.ssh > 206.189.234.114.56312: Flags [S.], seq 3373092197, ack 2049901113, win 65160, options [mss 1460,sackOK,TS val 2935074515 ecr 2499104609,nop,wscale 7], length 0
23:55:05.944373 IP 206.189.234.114.56312 > ubuntu-s-1vcpu-1gb-tor1-01.ssh: Flags [.], ack 1, win 229, options [nop,nop,TS val 2499104622 ecr 2935074515], length 0
23:55:05.966100 IP ubuntu-s-1vcpu-1gb-tor1-01.ssh > 206.189.234.114.56312: Flags [P.], seq 1:42, ack 1, win 510, options [nop,nop,TS val 2935074548 ecr 2499104622], length 41
23:55:05.977191 IP 206.189.234.114.56312 > ubuntu-s-1vcpu-1gb-tor1-01.ssh: Flags [.], ack 42, win 229, options [nop,nop,TS val 2499104654 ecr 2935074548], length 0
23:55:05.977192 IP 206.189.234.114.56312 > ubuntu-s-1vcpu-1gb-tor1-01.ssh: Flags [P.], seq 1:22, ack 42, win 229, options [nop,nop,TS val 2499104654 ecr 2935074548], length 21
23:55:05.977235 IP ubuntu-s-1vcpu-1gb-tor1-01.ssh > 206.189.234.114.56312: Flags [.], ack 22, win 510, options [nop,nop,TS val 2935074560 ecr 2499104654], length 0
23:55:05.979655 IP ubuntu-s-1vcpu-1gb-tor1-01.ssh > 206.189.234.114.56312: Flags [P.], seq 42:1098, ack 22, win 510, options [nop,nop,TS val 2935074562 ecr 2499104654], length 1056
23:55:05.990715 IP 206.189.234.114.56312 > ubuntu-s-1vcpu-1gb-tor1-01.ssh: Flags [P.], seq 22:462, ack 1098, win 245, options [nop,nop,TS val 2499104668 ecr 2935074562], length 440
23:55:05.990767 IP ubuntu-s-1vcpu-1gb-tor1-01.ssh > 206.189.234.114.56312: Flags [.], ack 462, win 507, options [nop,nop,TS val 2935074573 ecr 2499104668], length 0
23:55:06.001586 IP 206.189.234.114.56312 > ubuntu-s-1vcpu-1gb-tor1-01.ssh: Flags [P.], seq 462:510, ack 1098, win 245, options [nop,nop,TS val 2499104679 ecr 2935074573], length 48
23:55:06.001648 IP ubuntu-s-1vcpu-1gb-tor1-01.ssh > 206.189.234.114.56312: Flags [.], ack 510, win 507, options [nop,nop,TS val 2935074584 ecr 2499104679], length 0
23:55:06.012616 IP ubuntu-s-1vcpu-1gb-tor1-01.ssh > 206.189.234.114.56312: Flags [P.], seq 1098:1378, ack 510, win 507, options [nop,nop,TS val 2935074595 ecr 2499104679], length 280
23:55:06.028702 IP 206.189.234.114.56312 > ubuntu-s-1vcpu-1gb-tor1-01.ssh: Flags [P.], seq 510:526, ack 1378, win 262, options [nop,nop,TS val 2499104706 ecr 2935074595], length 16
23:55:06.028778 IP ubuntu-s-1vcpu-1gb-tor1-01.ssh > 206.189.234.114.56312: Flags [.], ack 526, win 507, options [nop,nop,TS val 2935074611 ecr 2499104706], length 0
23:55:06.039431 IP 206.189.234.114.56312 > ubuntu-s-1vcpu-1gb-tor1-01.ssh: Flags [P.], seq 526:578, ack 1378, win 262, options [nop,nop,TS val 2499104717 ecr 2935074611], length 52
23:55:06.039477 IP ubuntu-s-1vcpu-1gb-tor1-01.ssh > 206.189.234.114.56312: Flags [.], ack 578, win 507, options [nop,nop,TS val 2935074622 ecr 2499104717], length 0
23:55:06.039623 IP ubuntu-s-1vcpu-1gb-tor1-01.ssh > 206.189.234.114.56312: Flags [P.], seq 1378:1430, ack 578, win 507, options [nop,nop,TS val 2935074622 ecr 2499104717], length 52
23:55:06.050351 IP 206.189.234.114.56312 > ubuntu-s-1vcpu-1gb-tor1-01.ssh: Flags [P.], seq 578:662, ack 1430, win 262, options [nop,nop,TS val 2499104728 ecr 2935074622], length 84
23:55:06.091992 IP ubuntu-s-1vcpu-1gb-tor1-01.ssh > 206.189.234.114.56312: Flags [.], ack 662, win 507, options [nop,nop,TS val 2935074674 ecr 2499104728], length 0
23:55:07.958105 IP ubuntu-s-1vcpu-1gb-tor1-01.ssh > 111.196.181.101.42378: Flags [P.], seq 1430:1498, ack 662, win 507, options [nop,nop,TS val 16477378 ecr 68439221], length 68
23:55:08.202554 IP 111.196.181.101.42378 > ubuntu-s-1vcpu-1gb-tor1-01.ssh: Flags [P.], seq 662:714, ack 1498, win 501, options [nop,nop,TS val 68442743 ecr 16477378], length 52
23:55:08.202610 IP ubuntu-s-1vcpu-1gb-tor1-01.ssh > 111.196.181.101.42378: Flags [.], ack 714, win 507, options [nop,nop,TS val 16477623 ecr 68442743], length 0
23:55:08.202730 IP 111.196.181.101.42378 > ubuntu-s-1vcpu-1gb-tor1-01.ssh: Flags [F.], seq 714, ack 1498, win 501, options [nop,nop,TS val 68442743 ecr 16477378], length 0
23:55:08.204881 IP ubuntu-s-1vcpu-1gb-tor1-01.ssh > 111.196.181.101.42378: Flags [F.], seq 1498, ack 715, win 507, options [nop,nop,TS val 16477625 ecr 68442743], length 0
23:55:08.489451 IP 111.196.181.101.42378 > ubuntu-s-1vcpu-1gb-tor1-01.ssh: Flags [.], ack 1499, win 501, options [nop,nop,TS val 68443030 ecr 16477625], length 0
23:55:08.610586 IP ubuntu-s-1vcpu-1gb-tor1-01.ssh > 139.59.80.88.40686: Flags [P.], seq 1430:1498, ack 662, win 507, options [nop,nop,TS val 2961362826 ecr 728386157], length 68
23:55:08.730483 IP ubuntu-s-1vcpu-1gb-tor1-01.ssh > 182.73.147.154.42492: Flags [P.], seq 1430:1498, ack 662, win 507, options [nop,nop,TS val 4037810926 ecr 3250416348], length 68
23:55:08.859197 IP 139.59.80.88.40686 > ubuntu-s-1vcpu-1gb-tor1-01.ssh: Flags [P.], seq 662:714, ack 1498, win 262, options [nop,nop,TS val 728387038 ecr 2961362826], length 52
23:55:08.859197 IP 139.59.80.88.40686 > ubuntu-s-1vcpu-1gb-tor1-01.ssh: Flags [F.], seq 714, ack 1498, win 262, options [nop,nop,TS val 728387038 ecr 2961362826], length 0
23:55:08.859268 IP ubuntu-s-1vcpu-1gb-tor1-01.ssh > 139.59.80.88.40686: Flags [.], ack 714, win 507, options [nop,nop,TS val 2961363075 ecr 728387038], length 0
23:55:08.861331 IP ubuntu-s-1vcpu-1gb-tor1-01.ssh > 139.59.80.88.40686: Flags [F.], seq 1498, ack 715, win 507, options [nop,nop,TS val 2961363077 ecr 728387038], length 0
23:55:08.973107 IP 182.73.147.154.42492 > ubuntu-s-1vcpu-1gb-tor1-01.ssh: Flags [P.], seq 662:714, ack 1498, win 501, options [nop,nop,TS val 3250419868 ecr 4037810926], length 52
23:55:08.973108 IP 182.73.147.154.42492 > ubuntu-s-1vcpu-1gb-tor1-01.ssh: Flags [F.], seq 714, ack 1498, win 501, options [nop,nop,TS val 3250419868 ecr 4037810926], length 0
23:55:08.973198 IP ubuntu-s-1vcpu-1gb-tor1-01.ssh > 182.73.147.154.42492: Flags [.], ack 714, win 507, options [nop,nop,TS val 4037811169 ecr 3250419868], length 0
23:55:08.976364 IP ubuntu-s-1vcpu-1gb-tor1-01.ssh > 182.73.147.154.42492: Flags [F.], seq 1498, ack 715, win 507, options [nop,nop,TS val 4037811172 ecr 3250419868], length 0
23:55:09.109749 IP 139.59.80.88.40686 > ubuntu-s-1vcpu-1gb-tor1-01.ssh: Flags [.], ack 1499, win 262, options [nop,nop,TS val 728387101 ecr 2961363077], length 0
23:55:09.217112 IP 182.73.147.154.42492 > ubuntu-s-1vcpu-1gb-tor1-01.ssh: Flags [.], ack 1499, win 501, options [nop,nop,TS val 3250420112 ecr 4037811172], length 0
23:55:09.327498 IP ubuntu-s-1vcpu-1gb-tor1-01.ssh > 206.189.234.114.56312: Flags [P.], seq 1430:1498, ack 662, win 507, options [nop,nop,TS val 2935077910 ecr 2499104728], length 68
23:55:09.338369 IP 206.189.234.114.56312 > ubuntu-s-1vcpu-1gb-tor1-01.ssh: Flags [P.], seq 662:714, ack 1498, win 262, options [nop,nop,TS val 2499108016 ecr 2935077910], length 52
23:55:09.338370 IP 206.189.234.114.56312 > ubuntu-s-1vcpu-1gb-tor1-01.ssh: Flags [F.], seq 714, ack 1498, win 262, options [nop,nop,TS val 2499108016 ecr 2935077910], length 0
23:55:09.338413 IP ubuntu-s-1vcpu-1gb-tor1-01.ssh > 206.189.234.114.56312: Flags [.], ack 714, win 507, options [nop,nop,TS val 2935077921 ecr 2499108016], length 0
23:55:09.340666 IP ubuntu-s-1vcpu-1gb-tor1-01.ssh > 206.189.234.114.56312: Flags [F.], seq 1498, ack 715, win 507, options [nop,nop,TS val 2935077923 ecr 2499108016], length 0
23:55:09.351359 IP 206.189.234.114.56312 > ubuntu-s-1vcpu-1gb-tor1-01.ssh: Flags [.], ack 1499, win 262, options [nop,nop,TS val 2499108029 ecr 2935077923], length 0
23:55:13.540483 IP 116.1.180.22.33258 > ubuntu-s-1vcpu-1gb-tor1-01.ssh: Flags [S], seq 4044966560, win 14600, options [mss 1460,sackOK,TS val 1049475979 ecr 0,nop,wscale 7], length 0
23:55:13.540570 IP ubuntu-s-1vcpu-1gb-tor1-01.ssh > 116.1.180.22.33258: Flags [S.], seq 2034728999, ack 4044966561, win 65160, options [mss 1460,sackOK,TS val 1533595316 ecr 1049475979,nop,wscale 7], length 0
23:55:13.749198 IP no-reverse-dns-configured.com.46933 > ubuntu-s-1vcpu-1gb-tor1-01.9434: Flags [S], seq 2574722705, win 1024, length 0
23:55:13.749263 IP ubuntu-s-1vcpu-1gb-tor1-01.9434 > no-reverse-dns-configured.com.46933: Flags [R.], seq 0, ack 2574722706, win 0, length 0
23:55:13.779651 IP 116.1.180.22.33258 > ubuntu-s-1vcpu-1gb-tor1-01.ssh: Flags [.], ack 1, win 115, options [nop,nop,TS val 1049476219 ecr 1533595316], length 0
23:55:13.802176 IP ubuntu-s-1vcpu-1gb-tor1-01.ssh > 116.1.180.22.33258: Flags [P.], seq 1:42, ack 1, win 510, options [nop,nop,TS val 1533595578 ecr 1049476219], length 41
23:55:13.843322 IP no-reverse-dns-configured.com.46933 > ubuntu-s-1vcpu-1gb-tor1-01.9434: Flags [R], seq 2574722706, win 1200, length 0
23:55:14.041108 IP 116.1.180.22.33258 > ubuntu-s-1vcpu-1gb-tor1-01.ssh: Flags [.], ack 42, win 115, options [nop,nop,TS val 1049476480 ecr 1533595578], length 0
23:55:14.041109 IP 116.1.180.22.33258 > ubuntu-s-1vcpu-1gb-tor1-01.ssh: Flags [P.], seq 1:22, ack 42, win 115, options [nop,nop,TS val 1049476480 ecr 1533595578], length 21
23:55:14.041163 IP ubuntu-s-1vcpu-1gb-tor1-01.ssh > 116.1.180.22.33258: Flags [.], ack 22, win 510, options [nop,nop,TS val 1533595817 ecr 1049476480], length 0
23:55:14.043466 IP ubuntu-s-1vcpu-1gb-tor1-01.ssh > 116.1.180.22.33258: Flags [P.], seq 42:1098, ack 22, win 510, options [nop,nop,TS val 1533595819 ecr 1049476480], length 1056
23:55:14.282674 IP 116.1.180.22.33258 > ubuntu-s-1vcpu-1gb-tor1-01.ssh: Flags [P.], seq 22:462, ack 1098, win 131, options [nop,nop,TS val 1049476721 ecr 1533595819], length 440
23:55:14.282756 IP ubuntu-s-1vcpu-1gb-tor1-01.ssh > 116.1.180.22.33258: Flags [.], ack 462, win 507, options [nop,nop,TS val 1533596058 ecr 1049476721], length 0
23:55:14.521563 IP 116.1.180.22.33258 > ubuntu-s-1vcpu-1gb-tor1-01.ssh: Flags [P.], seq 462:510, ack 1098, win 131, options [nop,nop,TS val 1049476960 ecr 1533596058], length 48
23:55:14.521604 IP ubuntu-s-1vcpu-1gb-tor1-01.ssh > 116.1.180.22.33258: Flags [.], ack 510, win 507, options [nop,nop,TS val 1533596297 ecr 1049476960], length 0
23:55:14.533079 IP ubuntu-s-1vcpu-1gb-tor1-01.ssh > 116.1.180.22.33258: Flags [P.], seq 1098:1378, ack 510, win 507, options [nop,nop,TS val 1533596308 ecr 1049476960], length 280
23:55:14.779316 IP 116.1.180.22.33258 > ubuntu-s-1vcpu-1gb-tor1-01.ssh: Flags [P.], seq 510:526, ack 1378, win 148, options [nop,nop,TS val 1049477218 ecr 1533596308], length 16
23:55:14.779378 IP ubuntu-s-1vcpu-1gb-tor1-01.ssh > 116.1.180.22.33258: Flags [.], ack 526, win 507, options [nop,nop,TS val 1533596555 ecr 1049477218], length 0
23:55:15.018175 IP 116.1.180.22.33258 > ubuntu-s-1vcpu-1gb-tor1-01.ssh: Flags [P.], seq 526:578, ack 1378, win 148, options [nop,nop,TS val 1049477457 ecr 1533596555], length 52
23:55:15.018225 IP ubuntu-s-1vcpu-1gb-tor1-01.ssh > 116.1.180.22.33258: Flags [.], ack 578, win 507, options [nop,nop,TS val 1533596794 ecr 1049477457], length 0
23:55:15.018469 IP ubuntu-s-1vcpu-1gb-tor1-01.ssh > 116.1.180.22.33258: Flags [P.], seq 1378:1430, ack 578, win 507, options [nop,nop,TS val 1533596794 ecr 1049477457], length 52
23:55:15.257425 IP 116.1.180.22.33258 > ubuntu-s-1vcpu-1gb-tor1-01.ssh: Flags [P.], seq 578:662, ack 1430, win 148, options [nop,nop,TS val 1049477696 ecr 1533596794], length 84
23:55:15.300010 IP ubuntu-s-1vcpu-1gb-tor1-01.ssh > 116.1.180.22.33258: Flags [.], ack 662, win 507, options [nop,nop,TS val 1533597075 ecr 1049477696], length 0
23:55:16.126780 IP 194.147.140.98.58601 > ubuntu-s-1vcpu-1gb-tor1-01.4488: Flags [S], seq 2615742740, win 1024, length 0
23:55:16.126871 IP ubuntu-s-1vcpu-1gb-tor1-01.4488 > 194.147.140.98.58601: Flags [R.], seq 0, ack 2615742741, win 0, length 0
23:55:16.132844 IP 132.232.60.183.42464 > ubuntu-s-1vcpu-1gb-tor1-01.ssh: Flags [S], seq 1581472627, win 14600, options [mss 1424,sackOK,TS val 2342230759 ecr 0,nop,wscale 6], length 0
23:55:16.132893 IP ubuntu-s-1vcpu-1gb-tor1-01.ssh > 132.232.60.183.42464: Flags [S.], seq 2236288535, ack 1581472628, win 65160, options [mss 1460,sackOK,TS val 2319336047 ecr 2342230759,nop,wscale 7], length 0
23:55:16.224261 IP 194.147.140.98.58601 > ubuntu-s-1vcpu-1gb-tor1-01.4488: Flags [R], seq 2615742741, win 1200, length 0
23:55:16.399179 IP 132.232.60.183.42464 > ubuntu-s-1vcpu-1gb-tor1-01.ssh: Flags [.], ack 1, win 229, options [nop,nop,TS val 2342231025 ecr 2319336047], length 0
23:55:16.420453 IP ubuntu-s-1vcpu-1gb-tor1-01.ssh > 132.232.60.183.42464: Flags [P.], seq 1:42, ack 1, win 510, options [nop,nop,TS val 2319336335 ecr 2342231025], length 41
23:55:16.686356 IP 132.232.60.183.42464 > ubuntu-s-1vcpu-1gb-tor1-01.ssh: Flags [.], ack 42, win 229, options [nop,nop,TS val 2342231313 ecr 2319336335], length 0
23:55:16.686356 IP 132.232.60.183.42464 > ubuntu-s-1vcpu-1gb-tor1-01.ssh: Flags [P.], seq 1:22, ack 42, win 229, options [nop,nop,TS val 2342231313 ecr 2319336335], length 21
23:55:16.686420 IP ubuntu-s-1vcpu-1gb-tor1-01.ssh > 132.232.60.183.42464: Flags [.], ack 22, win 510, options [nop,nop,TS val 2319336601 ecr 2342231313], length 0
23:55:16.688975 IP ubuntu-s-1vcpu-1gb-tor1-01.ssh > 132.232.60.183.42464: Flags [P.], seq 42:1098, ack 22, win 510, options [nop,nop,TS val 2319336603 ecr 2342231313], length 1056
23:55:16.751266 IP 114.236.20.161.48824 > ubuntu-s-1vcpu-1gb-tor1-01.37215: Flags [S], seq 2256151524, win 34952, length 0
23:55:16.751321 IP ubuntu-s-1vcpu-1gb-tor1-01.37215 > 114.236.20.161.48824: Flags [R.], seq 0, ack 2256151525, win 0, length 0
23:55:17.444090 IP ubuntu-s-1vcpu-1gb-tor1-01.ssh > 132.232.60.183.42464: Flags [P.], seq 42:1098, ack 22, win 510, options [nop,nop,TS val 2319337358 ecr 2342231313], length 1056
23:55:17.709830 IP 132.232.60.183.42464 > ubuntu-s-1vcpu-1gb-tor1-01.ssh: Flags [.], ack 1098, win 274, options [nop,nop,TS val 2342232336 ecr 2319337358,nop,nop,sack 1 {42:1098}], length 0
23:55:18.534579 IP ubuntu-s-1vcpu-1gb-tor1-01.ssh > 116.1.180.22.33258: Flags [P.], seq 1430:1498, ack 662, win 507, options [nop,nop,TS val 1533600310 ecr 1049477696], length 68
23:55:18.773480 IP 116.1.180.22.33258 > ubuntu-s-1vcpu-1gb-tor1-01.ssh: Flags [P.], seq 662:714, ack 1498, win 148, options [nop,nop,TS val 1049481212 ecr 1533600310], length 52
23:55:18.773497 IP 116.1.180.22.33258 > ubuntu-s-1vcpu-1gb-tor1-01.ssh: Flags [F.], seq 714, ack 1498, win 148, options [nop,nop,TS val 1049481212 ecr 1533600310], length 0
23:55:18.773560 IP ubuntu-s-1vcpu-1gb-tor1-01.ssh > 116.1.180.22.33258: Flags [.], ack 714, win 507, options [nop,nop,TS val 1533600549 ecr 1049481212], length 0
23:55:18.777648 IP ubuntu-s-1vcpu-1gb-tor1-01.ssh > 116.1.180.22.33258: Flags [F.], seq 1498, ack 715, win 507, options [nop,nop,TS val 1533600553 ecr 1049481212], length 0
23:55:19.016380 IP 116.1.180.22.33258 > ubuntu-s-1vcpu-1gb-tor1-01.ssh: Flags [.], ack 1499, win 148, options [nop,nop,TS val 1049481455 ecr 1533600553], length 0
23:55:19.352312 IP 132.232.60.183.42464 > ubuntu-s-1vcpu-1gb-tor1-01.ssh: Flags [P.], seq 22:462, ack 1098, win 274, options [nop,nop,TS val 2342233979 ecr 2319337358], length 440
23:55:19.352384 IP ubuntu-s-1vcpu-1gb-tor1-01.ssh > 132.232.60.183.42464: Flags [.], ack 462, win 507, options [nop,nop,TS val 2319339267 ecr 2342233979], length 0
23:55:19.618288 IP 132.232.60.183.42464 > ubuntu-s-1vcpu-1gb-tor1-01.ssh: Flags [P.], seq 462:510, ack 1098, win 274, options [nop,nop,TS val 2342234245 ecr 2319339267], length 48
23:55:19.618337 IP ubuntu-s-1vcpu-1gb-tor1-01.ssh > 132.232.60.183.42464: Flags [.], ack 510, win 507, options [nop,nop,TS val 2319339533 ecr 2342234245], length 0
23:55:19.630308 IP ubuntu-s-1vcpu-1gb-tor1-01.ssh > 132.232.60.183.42464: Flags [P.], seq 1098:1378, ack 510, win 507, options [nop,nop,TS val 2319339545 ecr 2342234245], length 280
23:55:19.896046 IP 132.232.60.183.42464 > ubuntu-s-1vcpu-1gb-tor1-01.ssh: Flags [.], ack 1378, win 307, options [nop,nop,TS val 2342234522 ecr 2319339545], length 0
23:55:19.898225 IP 132.232.60.183.42464 > ubuntu-s-1vcpu-1gb-tor1-01.ssh: Flags [P.], seq 510:526, ack 1378, win 307, options [nop,nop,TS val 2342234525 ecr 2319339545], length 16
23:55:19.898254 IP ubuntu-s-1vcpu-1gb-tor1-01.ssh > 132.232.60.183.42464: Flags [.], ack 526, win 507, options [nop,nop,TS val 2319339813 ecr 2342234525], length 0
23:55:20.164128 IP 132.232.60.183.42464 > ubuntu-s-1vcpu-1gb-tor1-01.ssh: Flags [P.], seq 526:578, ack 1378, win 307, options [nop,nop,TS val 2342234790 ecr 2319339813], length 52
23:55:20.164171 IP ubuntu-s-1vcpu-1gb-tor1-01.ssh > 132.232.60.183.42464: Flags [.], ack 578, win 507, options [nop,nop,TS val 2319340079 ecr 2342234790], length 0
23:55:20.164351 IP ubuntu-s-1vcpu-1gb-tor1-01.ssh > 132.232.60.183.42464: Flags [P.], seq 1378:1430, ack 578, win 507, options [nop,nop,TS val 2319340079 ecr 2342234790], length 52
23:55:20.430203 IP 132.232.60.183.42464 > ubuntu-s-1vcpu-1gb-tor1-01.ssh: Flags [P.], seq 578:662, ack 1430, win 307, options [nop,nop,TS val 2342235056 ecr 2319340079], length 84
23:55:20.472015 IP ubuntu-s-1vcpu-1gb-tor1-01.ssh > 132.232.60.183.42464: Flags [.], ack 662, win 507, options [nop,nop,TS val 2319340386 ecr 2342235056], length 0
23:55:21.299987 IP 128.199.123.170.43916 > ubuntu-s-1vcpu-1gb-tor1-01.ssh: Flags [S], seq 2294026491, win 29200, options [mss 1460,sackOK,TS val 1580203942 ecr 0,nop,wscale 6], length 0
23:55:21.300063 IP ubuntu-s-1vcpu-1gb-tor1-01.ssh > 128.199.123.170.43916: Flags [S.], seq 3448488316, ack 2294026492, win 65160, options [mss 1460,sackOK,TS val 1106233439 ecr 1580203942,nop,wscale 7], length 0
23:55:21.560922 IP 128.199.123.170.43916 > ubuntu-s-1vcpu-1gb-tor1-01.ssh: Flags [.], ack 1, win 457, options [nop,nop,TS val 1580204008 ecr 1106233439], length 0
23:55:21.583722 IP ubuntu-s-1vcpu-1gb-tor1-01.ssh > 128.199.123.170.43916: Flags [P.], seq 1:42, ack 1, win 510, options [nop,nop,TS val 1106233723 ecr 1580204008], length 41
23:55:21.844122 IP 128.199.123.170.43916 > ubuntu-s-1vcpu-1gb-tor1-01.ssh: Flags [.], ack 42, win 457, options [nop,nop,TS val 1580204078 ecr 1106233723], length 0
23:55:21.844123 IP 128.199.123.170.43916 > ubuntu-s-1vcpu-1gb-tor1-01.ssh: Flags [P.], seq 1:22, ack 42, win 457, options [nop,nop,TS val 1580204078 ecr 1106233723], length 21
23:55:21.844194 IP ubuntu-s-1vcpu-1gb-tor1-01.ssh > 128.199.123.170.43916: Flags [.], ack 22, win 510, options [nop,nop,TS val 1106233984 ecr 1580204078], length 0
23:55:21.846983 IP ubuntu-s-1vcpu-1gb-tor1-01.ssh > 128.199.123.170.43916: Flags [P.], seq 42:1098, ack 22, win 510, options [nop,nop,TS val 1106233986 ecr 1580204078], length 1056
23:55:22.107489 IP 128.199.123.170.43916 > ubuntu-s-1vcpu-1gb-tor1-01.ssh: Flags [P.], seq 22:462, ack 1098, win 490, options [nop,nop,TS val 1580204144 ecr 1106233986], length 440
23:55:22.107581 IP ubuntu-s-1vcpu-1gb-tor1-01.ssh > 128.199.123.170.43916: Flags [.], ack 462, win 507, options [nop,nop,TS val 1106234247 ecr 1580204144], length 0
23:55:22.368041 IP 128.199.123.170.43916 > ubuntu-s-1vcpu-1gb-tor1-01.ssh: Flags [P.], seq 462:510, ack 1098, win 490, options [nop,nop,TS val 1580204209 ecr 1106234247], length 48
23:55:22.368088 IP ubuntu-s-1vcpu-1gb-tor1-01.ssh > 128.199.123.170.43916: Flags [.], ack 510, win 507, options [nop,nop,TS val 1106234507 ecr 1580204209], length 0
23:55:22.380041 IP ubuntu-s-1vcpu-1gb-tor1-01.ssh > 128.199.123.170.43916: Flags [P.], seq 1098:1378, ack 510, win 507, options [nop,nop,TS val 1106234519 ecr 1580204209], length 280
23:55:22.643994 IP 128.199.123.170.43916 > ubuntu-s-1vcpu-1gb-tor1-01.ssh: Flags [P.], seq 510:526, ack 1378, win 523, options [nop,nop,TS val 1580204278 ecr 1106234519], length 16
23:55:22.644096 IP ubuntu-s-1vcpu-1gb-tor1-01.ssh > 128.199.123.170.43916: Flags [.], ack 526, win 507, options [nop,nop,TS val 1106234783 ecr 1580204278], length 0
23:55:22.904550 IP 128.199.123.170.43916 > ubuntu-s-1vcpu-1gb-tor1-01.ssh: Flags [P.], seq 526:578, ack 1378, win 523, options [nop,nop,TS val 1580204343 ecr 1106234783], length 52
23:55:22.904611 IP ubuntu-s-1vcpu-1gb-tor1-01.ssh > 128.199.123.170.43916: Flags [.], ack 578, win 507, options [nop,nop,TS val 1106235044 ecr 1580204343], length 0
23:55:22.904876 IP ubuntu-s-1vcpu-1gb-tor1-01.ssh > 128.199.123.170.43916: Flags [P.], seq 1378:1430, ack 578, win 507, options [nop,nop,TS val 1106235044 ecr 1580204343], length 52
23:55:23.165276 IP 128.199.123.170.43916 > ubuntu-s-1vcpu-1gb-tor1-01.ssh: Flags [P.], seq 578:662, ack 1430, win 523, options [nop,nop,TS val 1580204409 ecr 1106235044], length 84
23:55:23.196808 IP 45.93.201.109.65534 > ubuntu-s-1vcpu-1gb-tor1-01.3372: Flags [S], seq 100, win 1024, length 0
23:55:23.196860 IP ubuntu-s-1vcpu-1gb-tor1-01.3372 > 45.93.201.109.65534: Flags [R.], seq 0, ack 101, win 0, length 0
23:55:23.197419 IP 45.93.201.109.65534 > ubuntu-s-1vcpu-1gb-tor1-01.3371: Flags [S], seq 100, win 1024, length 0
23:55:23.197438 IP ubuntu-s-1vcpu-1gb-tor1-01.3371 > 45.93.201.109.65534: Flags [R.], seq 0, ack 101, win 0, length 0
23:55:23.207998 IP ubuntu-s-1vcpu-1gb-tor1-01.ssh > 128.199.123.170.43916: Flags [.], ack 662, win 507, options [nop,nop,TS val 1106235347 ecr 1580204409], length 0
23:55:23.707463 IP ubuntu-s-1vcpu-1gb-tor1-01.ssh > 132.232.60.183.42464: Flags [P.], seq 1430:1498, ack 662, win 507, options [nop,nop,TS val 2319343622 ecr 2342235056], length 68
23:55:24.356003 IP ubuntu-s-1vcpu-1gb-tor1-01.ssh > 132.232.60.183.42464: Flags [P.], seq 1430:1498, ack 662, win 507, options [nop,nop,TS val 2319344270 ecr 2342235056], length 68
23:55:24.534298 IP 132.232.60.183.42464 > ubuntu-s-1vcpu-1gb-tor1-01.ssh: Flags [P.], seq 662:714, ack 1498, win 307, options [nop,nop,TS val 2342239161 ecr 2319343622], length 52
23:55:24.534354 IP ubuntu-s-1vcpu-1gb-tor1-01.ssh > 132.232.60.183.42464: Flags [.], ack 714, win 507, options [nop,nop,TS val 2319344449 ecr 2342239161], length 0
23:55:24.538034 IP ubuntu-s-1vcpu-1gb-tor1-01.ssh > 132.232.60.183.42464: Flags [F.], seq 1498, ack 714, win 507, options [nop,nop,TS val 2319344452 ecr 2342239161], length 0
23:55:24.621850 IP 132.232.60.183.42464 > ubuntu-s-1vcpu-1gb-tor1-01.ssh: Flags [.], ack 1498, win 307, options [nop,nop,TS val 2342239248 ecr 2319344270,nop,nop,sack 1 {1430:1498}], length 0
23:55:24.800183 IP 132.232.60.183.42464 > ubuntu-s-1vcpu-1gb-tor1-01.ssh: Flags [F.], seq 714, ack 1498, win 307, options [nop,nop,TS val 2342239426 ecr 2319344449], length 0
23:55:24.800226 IP ubuntu-s-1vcpu-1gb-tor1-01.ssh > 132.232.60.183.42464: Flags [.], ack 715, win 507, options [nop,nop,TS val 2319344715 ecr 2342239426], length 0
23:55:24.803819 IP 132.232.60.183.42464 > ubuntu-s-1vcpu-1gb-tor1-01.ssh: Flags [.], ack 1499, win 307, options [nop,nop,TS val 2342239430 ecr 2319344452], length 0
23:55:26.303709 IP 123.127.237.41.35198 > ubuntu-s-1vcpu-1gb-tor1-01.ssh: Flags [S], seq 135336159, win 29200, options [mss 1380,sackOK,TS val 2850977313 ecr 0,nop,wscale 7], length 0
23:55:26.303769 IP ubuntu-s-1vcpu-1gb-tor1-01.ssh > 123.127.237.41.35198: Flags [S.], seq 2671511911, ack 135336160, win 65160, options [mss 1460,sackOK,TS val 1432097199 ecr 2850977313,nop,wscale 7], length 0
23:55:26.442498 IP ubuntu-s-1vcpu-1gb-tor1-01.ssh > 128.199.123.170.43916: Flags [P.], seq 1430:1498, ack 662, win 507, options [nop,nop,TS val 1106238582 ecr 1580204409], length 68
23:55:26.704797 IP 128.199.123.170.43916 > ubuntu-s-1vcpu-1gb-tor1-01.ssh: Flags [P.], seq 662:714, ack 1498, win 523, options [nop,nop,TS val 1580205294 ecr 1106238582], length 52
23:55:26.704798 IP 128.199.123.170.43916 > ubuntu-s-1vcpu-1gb-tor1-01.ssh: Flags [F.], seq 714, ack 1498, win 523, options [nop,nop,TS val 1580205294 ecr 1106238582], length 0
23:55:26.704848 IP ubuntu-s-1vcpu-1gb-tor1-01.ssh > 128.199.123.170.43916: Flags [.], ack 714, win 507, options [nop,nop,TS val 1106238844 ecr 1580205294], length 0
23:55:26.706930 IP ubuntu-s-1vcpu-1gb-tor1-01.ssh > 128.199.123.170.43916: Flags [F.], seq 1498, ack 715, win 507, options [nop,nop,TS val 1106238846 ecr 1580205294], length 0
23:55:26.967302 IP 128.199.123.170.43916 > ubuntu-s-1vcpu-1gb-tor1-01.ssh: Flags [.], ack 1499, win 523, options [nop,nop,TS val 1580205359 ecr 1106238846], length 0
23:55:27.303308 IP 123.127.237.41.35198 > ubuntu-s-1vcpu-1gb-tor1-01.ssh: Flags [S], seq 135336159, win 29200, options [mss 1380,sackOK,TS val 2850977563 ecr 0,nop,wscale 7], length 0
23:55:27.303355 IP ubuntu-s-1vcpu-1gb-tor1-01.ssh > 123.127.237.41.35198: Flags [S.], seq 2671511911, ack 135336160, win 65160, options [mss 1460,sackOK,TS val 1432098199 ecr 2850977313,nop,wscale 7], length 0
23:55:27.595751 IP 123.127.237.41.35198 > ubuntu-s-1vcpu-1gb-tor1-01.ssh: Flags [.], ack 1, win 229, options [nop,nop,TS val 2850977636 ecr 1432098199], length 0
23:55:27.616559 IP ubuntu-s-1vcpu-1gb-tor1-01.ssh > 123.127.237.41.35198: Flags [P.], seq 1:42, ack 1, win 510, options [nop,nop,TS val 1432098512 ecr 2850977636], length 41
23:55:27.889700 IP 123.127.237.41.35198 > ubuntu-s-1vcpu-1gb-tor1-01.ssh: Flags [.], ack 42, win 229, options [nop,nop,TS val 2850977709 ecr 1432098512], length 0
23:55:27.891447 IP 123.127.237.41.35198 > ubuntu-s-1vcpu-1gb-tor1-01.ssh: Flags [P.], seq 1:22, ack 42, win 229, options [nop,nop,TS val 2850977710 ecr 1432098512], length 21
23:55:27.891475 IP ubuntu-s-1vcpu-1gb-tor1-01.ssh > 123.127.237.41.35198: Flags [.], ack 22, win 510, options [nop,nop,TS val 1432098787 ecr 2850977710], length 0
23:55:27.894285 IP ubuntu-s-1vcpu-1gb-tor1-01.ssh > 123.127.237.41.35198: Flags [P.], seq 42:1098, ack 22, win 510, options [nop,nop,TS val 1432098790 ecr 2850977710], length 1056
23:55:28.155567 IP 123.127.237.41.35198 > ubuntu-s-1vcpu-1gb-tor1-01.ssh: Flags [P.], seq 22:462, ack 1098, win 245, options [nop,nop,TS val 2850977776 ecr 1432098790], length 440
23:55:28.155659 IP ubuntu-s-1vcpu-1gb-tor1-01.ssh > 123.127.237.41.35198: Flags [.], ack 462, win 507, options [nop,nop,TS val 1432099051 ecr 2850977776], length 0
23:55:28.406779 IP 123.127.237.41.35198 > ubuntu-s-1vcpu-1gb-tor1-01.ssh: Flags [P.], seq 462:510, ack 1098, win 245, options [nop,nop,TS val 2850977838 ecr 1432099051], length 48
23:55:28.406914 IP ubuntu-s-1vcpu-1gb-tor1-01.ssh > 123.127.237.41.35198: Flags [.], ack 510, win 507, options [nop,nop,TS val 1432099302 ecr 2850977838], length 0
23:55:28.417719 IP ubuntu-s-1vcpu-1gb-tor1-01.ssh > 123.127.237.41.35198: Flags [P.], seq 1098:1378, ack 510, win 507, options [nop,nop,TS val 1432099313 ecr 2850977838], length 280
23:55:28.710571 IP 123.127.237.41.35198 > ubuntu-s-1vcpu-1gb-tor1-01.ssh: Flags [P.], seq 510:526, ack 1378, win 262, options [nop,nop,TS val 2850977914 ecr 1432099313], length 16
23:55:28.710636 IP ubuntu-s-1vcpu-1gb-tor1-01.ssh > 123.127.237.41.35198: Flags [.], ack 526, win 507, options [nop,nop,TS val 1432099606 ecr 2850977914], length 0
root@ubuntu-s-1vcpu-1gb-tor1-01:~# 
